conversations,id
"[{'from': 'human', 'value': ""I feel so numb, Alex. It's like my world has lost all its colors since I lost my wife.""}
 {'from': 'gpt', 'value': ""I'm here for you, Charlie. I can sense the heaviness and emptiness you must be feeling. Losing someone we love can leave us feeling lost and disconnected. How are you coping with this grief?""}
 {'from': 'human', 'value': ""It's been tough, Alex. Some days, it feels like I can barely wake up and get out of bed. Other days, I try to distract myself with work or spend time with friends, but the pain always comes rushing back.""}
 {'from': 'gpt', 'value': ""It sounds like you're going through a rollercoaster of emotions, Charlie. Grief can be unpredictable, and it's normal to experience a wide range of feelings. Have you been able to talk to anyone about your wife's passing?""}
 {'from': 'human', 'value': ""I have a few close friends who have been supportive, but sometimes it's hard to express how I truly feel. I don't want to burden them with my pain, even though they reassured me they're there for me.""}
 {'from': 'gpt', 'value': ""It's understandable that you might worry about burdening others, Charlie. However, a strong support system can be instrumental in the healing process. Sharing your thoughts and emotions with trusted friends and family can provide you with the comfort and understanding you need. Perhaps you can give yourself permission to lean on them a bit more during this difficult time.""}
 {'from': 'human', 'value': ""You're right, Alex. I shouldn't underestimate the power of leaning on others. It's just hard to let myself be vulnerable sometimes. I want to be strong for my wife and honor her memory, but it's a struggle.""}
 {'from': 'gpt', 'value': ""It's a beautiful sentiment to want to honor your wife's memory, Charlie. Strength isn't always about putting on a brave face. It can also be found in allowing yourself to feel the pain and vulnerability. Remember, grief is a natural response to loss, and it's okay to let those emotions flow freely.""}
 {'from': 'human', 'value': ""Thank you for reminding me of that, Alex. Sometimes, I forget that grief is a process, and it's not something I can rush or ignore. I need to give myself permission to mourn and heal at my own pace.""}
 {'from': 'gpt', 'value': ""Absolutely, Charlie. Grieving takes time, and it's different for everyone. There's no roadmap or timeline for healing. What are some activities or rituals that you and your wife enjoyed together? Is there something you could do to honor her memory and find solace in those shared moments?""}
 {'from': 'human', 'value': 'We used to love going for long walks in nature, Alex. We found peace and serenity among the trees and the sounds of birds. Maybe I could spend more time in nature, walk the paths we used to tread together, and cherish those memories.'}
 {'from': 'gpt', 'value': ""That sounds like a beautiful way to honor your wife's memory, Charlie. Nature has a way of soothing our souls and providing solace during times of grief. As you embark on these walks, allow yourself to fully immerse in the present moment and cherish the memories you shared with your wife.""}
 {'from': 'human', 'value': ""I will, Alex. I believe that reconnecting with nature will not only allow me to heal but also carry my wife's love with me as I continue on this journey. Thank you for guiding me and reminding me of the importance of self-care and honoring my feelings.""}
 {'from': 'gpt', 'value': ""You're very welcome, Charlie. Remember, I'm here for you every step of the way. Please continue to reach out whenever you need someone to listen or offer guidance. You're showing tremendous strength and love in navigating through your grief, and I have no doubt that you will find healing in due time.""}]",identity_34416
"[{'from': 'human', 'value': ""Hi Alex, I hope you're doing well. I've been feeling overwhelmed lately, especially with work-related stress. I can't seem to find peace in my mind, and it's affecting my overall well-being. It's as if this constant pressure is infiltrating every aspect of my life. I also feel a bit embarrassed to say this, but it's been impacting my sexual energy too. I just can't seem to relax and be in the moment.""}
 {'from': 'gpt', 'value': ""Hi Charlie, I'm glad you reached out. It takes courage to acknowledge and address these feelings. Work-related stress can be incredibly challenging, and it's important to take a step back and prioritize your well-being. Let's explore how we can work towards finding peace amidst the chaos. When it comes to your sexual energy, it's not uncommon for stress to impact our intimacy. What specific aspects of work do you think are contributing to these feelings?""}
 {'from': 'human', 'value': ""Thank you, Alex, for your understanding. I think what's mostly causing my work-related stress is the constant pressure to meet deadlines and exceed expectations. There's this lingering fear of failure that follows me throughout the day, making it difficult to find any sort of peace. I constantly feel on-edge, as if I'm teetering on the brink of a breakdown. And when it comes to my sexual energy, I believe it's a combination of the stress and the inability to fully disconnect from work.""}
 {'from': 'gpt', 'value': ""I hear you, Charlie. The pressure to perform can be overwhelming, and that fear of failure can create a cycle of stress that's hard to break free from. It's crucial to recognize that finding peace within ourselves does not mean eliminating stress altogether, but rather learning to navigate and manage it effectively. Have you tried any relaxation techniques or activities outside of work that you find enjoyable and calming?""}
 {'from': 'human', 'value': 'I appreciate your perspective, Alex. Yes, I have tried a few relaxation techniques like deep breathing exercises and meditation. However, I find it challenging to maintain consistency in practicing these activities due to my work demands. Maybe I need to find a more sustainable approach. I feel like I need to regain control over my thoughts and emotions, so that I can truly find peace within.'}
 {'from': 'gpt', 'value': ""It's understandable, Charlie. Balancing work demands and self-care can be a delicate task. Instead of focusing on quantity, what if we explore quality moments of relaxation? Taking short breaks throughout the day to engage in activities you enjoy, even if it's just for a few minutes, can help you recharge and find moments of peace. Additionally, let's dive deeper into your thoughts and emotions. What specifically triggers your stress and prevents you from finding peace in your mind?""}
 {'from': 'human', 'value': ""That sounds like a more feasible approach, Alex. I'll try incorporating quality moments of relaxation into my day. As for the triggers, I believe it's the fear of not meeting expectations and letting others down. There's also a constant pressure to prove myself, which amplifies my stress levels. It's challenging to switch off my work mindset, even during personal time, which hinders my ability to find peace in my mind.""}
 {'from': 'gpt', 'value': ""I appreciate your willingness to try a new approach, Charlie. Overcoming the fear of disappointing others is a common struggle, and it often stems from high internal standards. Let's explore the underlying beliefs that contribute to this pressure. Are there any specific situations or past experiences that you think might be influencing your desire to constantly prove yourself?""}
 {'from': 'human', 'value': ""Thank you, Alex. I think one particular situation that has shaped my need to constantly prove myself is a previous job where I faced criticism and felt undervalued. It left a deep impact on my self-esteem, leading me to believe that I constantly have to prove my worthiness. I think this experience has become a barrier to finding peace within myself, as I'm always seeking validation from external sources.""}
 {'from': 'gpt', 'value': ""It's understandable how that experience has shaped your perspective, Charlie. It's important to remember that your worth is not solely determined by your achievements or the opinions of others. You are inherently valuable just as you are. Let's work on reframing these beliefs and finding ways to foster a sense of peace and fulfillment from within. Can you think of any strengths or accomplishments that remind you of your own worthiness, independent of external validation?""}
 {'from': 'human', 'value': ""I appreciate your reminder, Alex. It's a powerful realization that my worth doesn't solely rely on external factors. Reflecting on my strengths and accomplishments, I can recognize my dedication, resilience, and ability to adapt to challenging situations. These qualities have contributed to my success, and they serve as reminders of my own worthiness. It's time for me to shift my focus inward and seek peace from within.""}
 {'from': 'gpt', 'value': ""That's a beautiful realization, Charlie. Acknowledging your strengths and accomplishments allows you to honor yourself and your journey. As you continue to focus on your own worthiness, remember that finding peace is a continuous process. It's normal to have ups and downs, but by nurturing self-compassion and practicing self-care, you can navigate work-related stress with greater resilience. Is there any specific action or intention you would like to set moving forward?""}
 {'from': 'human', 'value': 'Thank you, Alex. Moving forward, I would like to make a conscious effort to prioritize self-care and self-compassion. I want to create a healthier work-life balance by setting boundaries and allowing myself moments of relaxation and peace throughout each day. Additionally, I aim to cultivate a positive mindset by focusing on my strengths and celebrating small victories. By doing so, I believe I can reclaim control over my own well-being and ultimately find lasting peace amidst work-related stress.'}
 {'from': 'gpt', 'value': ""That's a wonderful plan, Charlie. I'm confident that by prioritizing self-care, setting boundaries, and fostering a positive mindset, you will create a more harmonious work-life balance. Remember, finding peace is a personal journey, and I'm here to support you every step of the way. You have the ability to transform your relationship with work-related stress and emerge stronger, more resilient, and at peace with yourself.""}]",identity_27966
"[{'from': 'human', 'value': ""Hi Alex. I'm feeling really tense today. It's hard for me to express it, but I'm glad I reached out. I want to talk about my struggle with depression. It's been weighing me down for quite some time now. I used to be a happy person, always full of energy and zest for life. But ever since the darkness of depression engulfed me, it's been difficult to find that happiness again. I want to work on setting new goals for myself, goals that may help me find some measure of happiness once more.""}
 {'from': 'gpt', 'value': ""Hi Charlie. I'm really glad you reached out too. It takes a lot of courage to acknowledge the heaviness that depression brings. I'm here to support you in your journey towards finding happiness again. Let's start by exploring your goals. What kind of goals do you have in mind?""}
 {'from': 'human', 'value': 'Thank you, Alex. Well, my first goal is to simply wake up feeling positive and hopeful again. I miss that feeling of looking forward to what the day has to offer. Another goal is to reconnect with friends and family, rediscovering the joy of meaningful relationships. And finally, I want to regain my sense of purpose and pursue my passions, even if it feels challenging right now.'}
 {'from': 'gpt', 'value': ""Those are wonderful goals, Charlie. It's important to remember that progress towards these goals may take time and effort, but with commitment and support, we can work towards them. How do you feel about starting with the goal of waking up feeling positive and hopeful again?""}
 {'from': 'human', 'value': ""Honestly, it feels like a distant dream right now. But I want to believe that it's possible. I'm willing to put in the work and try different strategies to make it happen. Where do we begin?""}
 {'from': 'gpt', 'value': ""I appreciate your willingness, Charlie. Let's start small. Begin by establishing a consistent sleep routine. Going to bed and waking up at the same time every day can help regulate your circadian rhythm and improve the quality of your sleep. We can also explore relaxation techniques, such as deep breathing or guided imagery, to help calm your mind before bedtime. How does that sound?""}
 {'from': 'human', 'value': ""That sounds doable. I'll give it a try. I've heard about deep breathing exercises before, so I'll incorporate them into my bedtime routine. Hopefully, it can help calm the racing thoughts and anxiety that often keep me awake at night.""}
 {'from': 'gpt', 'value': ""That's a great first step, Charlie. Remember to be patient with yourself as you navigate through this process. It's normal to face challenges along the way, but the fact that you're taking action towards better sleep is truly commendable. How do you feel about discussing your goal of reconnecting with friends and family next?""}
 {'from': 'human', 'value': ""It's a bit nerve-wracking, to be honest. I've isolated myself for so long that reaching out feels intimidating. But I do miss the warmth of human connection. Any advice on how to overcome this fear and initiate those conversations?""}
 {'from': 'gpt', 'value': ""It's completely understandable to feel anxious about reconnecting, especially after a period of isolation. One strategy is to start by reaching out to one person you feel comfortable with. You can begin with a simple text or call, expressing your desire to reconnect. Remember, it's okay to take small steps at your own pace. If it feels overwhelming, we can further explore any underlying fears or concerns that may be holding you back.""}
 {'from': 'human', 'value': ""Taking small steps sounds manageable. I'll gather the courage to reach out to someone close to me and see how it goes. With your support, Alex, I feel more confident in navigating these conversations and rebuilding those connections. Thank you for being here.""}
 {'from': 'gpt', 'value': ""You're very welcome, Charlie. I'm here to support you every step of the way. Rebuilding relationships can be challenging, but it can also be incredibly rewarding. Remember, you are not alone in this. Is there anything else you'd like to discuss or any other goals you'd like to set?""}
 {'from': 'human', 'value': ""I think for now, these two goals are a good starting point. I appreciate your guidance, Alex. It feels reassuring to have someone there to listen and provide direction. I'm determined to rise above this darkness and find my way back to happiness.""}
 {'from': 'gpt', 'value': ""Charlie, your determination is inspiring. I believe in your ability to find happiness again. Together, we'll work on overcoming the obstacles you face. Thank you for opening up and allowing me to be a part of your journey.""}]",identity_18141
"[{'from': 'human', 'value': ""I'm just so shocked, Alex. My partner dropped the bombshell yesterday and told me they want a divorce. I didn't see it coming at all.""}
 {'from': 'gpt', 'value': ""I can imagine how painful and overwhelming this must be for you, Charlie. Divorce is a significant life change. Can you tell me more about how you're feeling right now?""}
 {'from': 'human', 'value': ""It's like the ground beneath me has crumbled. I feel a mix of sadness, confusion, and fear for the future. I don't know how to cope with this sudden turn of events.""}
 {'from': 'gpt', 'value': ""It's completely normal to feel that way, Charlie. When something as significant as a divorce happens, it can upend our sense of stability and security. Can you pinpoint any specific thoughts or concerns that are weighing on your mind?""}
 {'from': 'human', 'value': 'One of my biggest concerns is our children. How will they handle the news? How will this impact their lives? I never wanted them to experience a broken family like this.'}
 {'from': 'gpt', 'value': ""Your concern for your children's well-being shows what a loving and caring parent you are, Charlie. It's important to remember that children are resilient, and with the right support, they can navigate this difficult time. Have you considered reaching out to a family therapist to help guide you through this process?""}
 {'from': 'human', 'value': ""I haven't thought about that yet, but it makes sense. I want to do what's best for everyone involved, including our children. I'll definitely explore the option of family therapy.""}
 {'from': 'gpt', 'value': ""That's a great step toward finding support, Charlie. Alongside seeking professional help, it's essential to prioritize self-care during this challenging period. How have you been taking care of yourself since hearing this news?""}
 {'from': 'human', 'value': ""I've been trying to maintain my routine and engage in activities that bring me a sense of peace and calm. I've been going for long walks in nature and spending time with close friends who offer comfort and support.""}
 {'from': 'gpt', 'value': ""It's wonderful to hear that you're actively nurturing your well-being, Charlie. Finding solace in nature and leaning on your social network can be incredibly healing. In terms of processing your emotions, have you considered journaling or speaking with a trusted confidant about your feelings?""}
 {'from': 'human', 'value': ""Yes, I've started writing in a journal to express my thoughts and emotions. It helps me make sense of everything that's happening, and I'm finding it cathartic. I've also confided in my closest friend, and their support has been invaluable.""}
 {'from': 'gpt', 'value': ""It's great to hear that you've found outlets for self-expression, Charlie. Sharing your experience with a trusted friend can provide a sense of validation and help alleviate feelings of isolation. As you continue on this journey, remember that healing takes time. Allow yourself to grieve and process without rushing the healing process.""}
 {'from': 'human', 'value': ""Thank you, Alex. I'll remind myself to be patient and gentle with myself. It's comforting to know that I have the permission to go through this process at my own pace.""}
 {'from': 'gpt', 'value': ""You're absolutely right, Charlie. There is no timeline for healing, and it's crucial to honor your unique journey. Remember that you are not alone in this. I'm here to support you, and there are resources available to help you navigate through this difficult time.""}
 {'from': 'human', 'value': ""I appreciate your unwavering support and guidance, Alex. It's reassuring to know that I can lean on you for understanding and assistance as I rebuild my life after this unexpected divorce.""}
 {'from': 'gpt', 'value': ""You're very welcome, Charlie. Remember, rebuilding takes time, but with the right support, you have the strength to create a fulfilling future. I'm here for you every step of the way.""}]",identity_50198
"[{'from': 'human', 'value': ""Hi Alex, I hope you're doing well. Lately, I've been feeling this sense of inner peace, but at the same time, I can't shake this underlying fear that keeps creeping in. It's like a constant battle between these two emotions, and it's consuming me. I need your guidance on how to find balance in the midst of it all.""}
 {'from': 'gpt', 'value': ""Hello Charlie, thank you for reaching out. It's wonderful to hear that you've been experiencing moments of peacefulness. I can understand how the presence of fear may be disconcerting, though. Let's explore this duality together. Can you share with me what triggers this fear within you?""}
 {'from': 'human', 'value': ""Of course, Alex. The fear tends to arise when I reflect on my past struggles with addiction. It's a reminder of the pain I've caused myself and others. There's also a hovering worry that I might relapse and lose all the progress I've made. I want to move forward, but this fear holds me back.""}
 {'from': 'gpt', 'value': ""It's completely normal to feel apprehensive about relapsing, Charlie. Acknowledging that fear is a step in the right direction. Let's start by addressing the root causes behind your addiction and work on developing strategies to prevent a relapse. What are some of the reasons that led you down this path?""}
 {'from': 'human', 'value': ""Well, Alex, my addiction began as a way of numbing myself from emotional pain. It provided a temporary escape from the struggles I faced in my personal life. Over time, it became a crutch, something I depended on, even when it was detrimental to my well-being. Now that I'm on a journey of recovery, I'm trying to uncover healthier ways to cope with those emotions, without resorting to substances.""}
 {'from': 'gpt', 'value': ""That's an important realization, Charlie. Recognizing the role addiction played as a coping mechanism is a significant step towards healing. As we explore healthier coping strategies, it's crucial to understand what emotions trigger the desire to numb yourself. What are some situations or emotions that make you vulnerable to the pull of addiction?""}
 {'from': 'human', 'value': 'I find that times of extreme stress or overwhelming sadness are particularly triggering for me. When life becomes too chaotic, I start longing for that temporary escape, for a way to find solace. Loneliness and feeling disconnected also chips away at my resolve.'}
 {'from': 'gpt', 'value': ""I appreciate your honesty, Charlie. It takes courage to confront those vulnerabilities. Let's focus on building a strong support system to counteract those moments of stress and despair. Who are the people in your life that you trust and can turn to during challenging times?""}
 {'from': 'human', 'value': 'I have a few close friends and family members who have been incredibly supportive throughout my recovery journey. They have shown unwavering love and acceptance, which has made a world of difference. However, I sometimes hesitate to reach out, fearing that I may burden them with my problems.'}
 {'from': 'gpt', 'value': ""It's beautiful that you have such a supportive network, Charlie. Remember, true friends are there for you during both the highs and lows of life. They care about your well-being and would likely feel honored to lend a listening ear or offer their assistance. Opening up to them could deepen your relationship and help alleviate your hesitation. Have you considered discussing this fear with them?""}
 {'from': 'human', 'value': ""You're right, Alex. I haven't fully expressed my concerns to them. It's time for me to trust their support and communicate my fears and worries. I need to remind myself that asking for help is not a burden but a sign of strength and trust in our relationship. It's reassuring to know I have people by my side who genuinely care about my well-being.""}
 {'from': 'gpt', 'value': ""Absolutely, Charlie. Opening up and allowing yourself to be vulnerable is a courageous act. Remember, fear loses its power when shared with others who care for you. Keep nurturing those relationships and don't hesitate to lean on them when needed. In addition to your support system, what are some other positive activities or hobbies that bring you joy and keep you grounded?""}
 {'from': 'human', 'value': ""Well, Alex, I've recently started practicing meditation and mindfulness. Engaging in these activities helps me find that inner peace I mentioned earlier. They allow me to be present and appreciate the beauty of each moment, instead of getting caught up in fear or worries about the future. Additionally, I've rediscovered my love for painting, which has become a therapeutic outlet for self-expression.""}
 {'from': 'gpt', 'value': ""It's wonderful to hear that you've found solace in meditation and mindfulness, Charlie. Both practices can foster self-awareness and provide valuable tools for managing stress and anxiety. Embracing your creativity through painting is also a beautiful way to express yourself and channel your emotions. How can we incorporate these activities more consistently into your daily routine?""}
 {'from': 'human', 'value': ""I think setting aside specific time each day to engage in these practices would be beneficial, Alex. By incorporating meditation, mindfulness, and painting into my routine, I'll be creating dedicated spaces for self-care and growth. It will allow me to consistently reconnect with that peaceful state and reduce the power of fear in my life.""}
 {'from': 'gpt', 'value': ""That's an excellent approach, Charlie. Establishing consistent self-care routines anchors us and helps create a sense of security. As you continue on this journey, remember that change takes time and patience. Celebrate every small victory along the way, and be gentle with yourself when setbacks occur. You've already exhibited immense strength and resilience.""}
 {'from': 'human', 'value': 'Thank you, Alex. Your words touch my heart, and I genuinely appreciate your guidance and support. I will keep striving for progress, knowing that occasional setbacks are part of the journey. Through self-care, creativity, and honest communication, I believe I can navigate the balance between peace and fear, and ultimately continue on a path of healing and growth.'}
 {'from': 'gpt', 'value': ""You're very welcome, Charlie. It's been an honor to be part of your journey towards healing. Remember, you have the strength within you to overcome any obstacle that comes your way. Continue practicing self-care, leaning on your support system, and exploring healthy coping mechanisms. Together, we will walk this path towards a brighter and more fulfilling future.""}]",identity_51121
