conversations,id
"[{'from': 'human', 'value': ""Hi Alex, I'm feeling so ashamed of myself lately. It's like I can't do anything right and I constantly feel like a failure.""}
 {'from': 'gpt', 'value': ""Hi Charlie, I'm really sorry to hear that you're feeling this way. It sounds like you're being really hard on yourself. Can you tell me more about what's been happening?""}
 {'from': 'human', 'value': ""Yeah, it's just that I've been setting all these goals for myself, but I keep coming up short. It's like no matter how hard I try, I never seem to reach the level of success I want. It's so frustrating!""}
 {'from': 'gpt', 'value': ""It can definitely be incredibly frustrating when we set goals for ourselves and don't achieve them. Let's explore this further. What are some specific goals you've been working towards?""}
 {'from': 'human', 'value': ""Well, one of my goals was to start a small business on the side, but it didn't work out and I had to close it down. Another goal was to improve my physical fitness, but I haven't been able to stick to my workout routine. It feels like I'm failing on multiple fronts.""}
 {'from': 'gpt', 'value': ""It's understandable that you would feel disappointed and discouraged when your goals aren't being met. I'm curious, Charlie, have you ever considered what might be getting in the way of success?""}
 {'from': 'human', 'value': ""I think a big part of it is my fear of failure. I put so much pressure on myself to succeed that it becomes paralyzing. I start doubting my abilities and second-guessing every decision I make. It's like I don't want to take risks because I'm scared of failing.""}
 {'from': 'gpt', 'value': 'Fear of failure is something many people struggle with, Charlie. It can hold us back from taking risks and pursuing our dreams. Are there any specific instances in your life where you believe this fear has impacted your decision-making?'}
 {'from': 'human', 'value': ""Well, I remember a time when I was offered a promotion at work, but I turned it down because I was afraid I wouldn't be able to handle the added responsibilities. Looking back, I'm starting to realize how much this fear has limited me.""}
 {'from': 'gpt', 'value': ""Recognizing the impact fear has had on your decision-making is a huge step, Charlie. Now that you're aware of it, what do you think you can do to overcome this fear and start embracing new opportunities?""}
 {'from': 'human', 'value': ""I think one thing I can do is to reframe failure as a learning experience. Instead of seeing it as a reflection of my worth as a person, I could view it as an opportunity for growth and improvement. It would require a shift in my mindset, but I believe it's possible.""}
 {'from': 'gpt', 'value': ""That's a wonderful perspective, Charlie! Viewing failure as a learning experience can be incredibly empowering and help you to approach goals with less pressure. What are some strategies you can implement to help reframe failure in this way?""}
 {'from': 'human', 'value': ""I think practicing self-compassion is key. Instead of beating myself up for not meeting my goals, I can remind myself that it's okay to stumble along the way. I can also seek support from loved ones who can provide encouragement and remind me of my strengths.""}
 {'from': 'gpt', 'value': ""Absolutely, Charlie! Self-compassion and a strong support system can make a world of difference in our ability to bounce back from setbacks. Remember, you're not alone on this journey.""}
 {'from': 'human', 'value': ""Thank you, Alex. It means a lot to me to have your support and guidance. I'm feeling hopeful and excited about reframing my relationship with failure. I think this is going to be a game-changer for me.""}
 {'from': 'gpt', 'value': ""You're more than welcome, Charlie. I'm glad I could be here to help you navigate through these feelings of shame and failure. Remember, you are capable of achieving great things, and experiencing setbacks along the way doesn't diminish your worth. I'm excited to see the positive changes that lie ahead for you.""}]",identity_98343
"[{'from': 'human', 'value': ""Hi Alex, I've been feeling a bit worried lately, and I think I might be dealing with some bullying at work.""}
 {'from': 'gpt', 'value': ""Hello Charlie, thank you for reaching out. I'm here to listen and help. It takes courage to open up about such experiences. Can you tell me more about what's been going on?""}
 {'from': 'human', 'value': ""Sure, Alex. It's been really hard for me to go to work every day. I feel like my colleagues are constantly putting me down and making me doubt myself. It's affecting my confidence and overall happiness.""}
 {'from': 'gpt', 'value': 'I can understand how challenging this must be for you, Charlie. Bullying can have a significant impact on our mental well-being. Tell me, how has this situation been affecting your mood outside of work?'}
 {'from': 'human', 'value': ""Well, I find myself feeling low and finding it difficult to enjoy things I used to love. The constant negativity at work takes a toll on me, and it's hard to shake off.""}
 {'from': 'gpt', 'value': ""It's unfortunate that the bullying is taking away from your joy outside of work as well. It's important to remember that it's not your fault and you deserve to be treated with respect. Have you considered speaking up about this issue to your superiors or HR?""}
 {'from': 'human', 'value': ""I've thought about it, but I'm worried it might make things worse. I don't want to make a big deal out of it, you know?""}
 {'from': 'gpt', 'value': ""I understand your concern, Charlie. It's important to prioritize your well-being and address this issue. Perhaps we can explore some strategies to help you navigate this situation. Can you think of any trusted individuals within your workplace who you could confide in?""}
 {'from': 'human', 'value': ""Well, there is one colleague I trust. We've been friends for a while, and I think he might be able to offer some support.""}
 {'from': 'gpt', 'value': ""That's a great start, Charlie. Building a support network can make a significant difference. It's important to express your feelings and let others know what you're going through. Additionally, have you considered seeking professional help from a therapist to help you work through these emotions and develop coping strategies?""}
 {'from': 'human', 'value': ""I haven't really considered therapy, but it sounds like it could be helpful. I just want to find a way to feel happier and more secure in myself.""}
 {'from': 'gpt', 'value': ""Therapy can indeed provide a safe and supportive environment for you to explore your emotions and gain the tools you need to cope with this situation. If you're open to it, I can assist you in finding a therapist near you who specializes in dealing with workplace bullying and depression.""}
 {'from': 'human', 'value': ""That would be great, Alex. I appreciate your guidance and support. I'm willing to try anything to regain my happiness.""}
 {'from': 'gpt', 'value': ""I'm glad to hear that, Charlie. Taking the first step towards seeking help is often the hardest part. Remember, you're not alone in this journey, and I'm here for you every step of the way. Let's work towards finding a therapist who can provide the support you need to overcome this challenging period in your life.""}]",identity_79390
"[{'from': 'human', 'value': ""Hi Alex, I hope you're doing well. I'm feeling incredibly painful right now, consumed by grief. It's been months since the breakup, but I just can't seem to move forward.""}
 {'from': 'gpt', 'value': ""Hello Charlie, thank you for reaching out. I'm here to listen and support you. Heartbreak can be incredibly painful, and experiencing grief is a natural part of the healing process. Can you tell me more about how you're feeling?""}
 {'from': 'human', 'value': ""Thanks, Alex. It means a lot to have someone who understands. I feel lost and empty, like a part of me is missing. The pain lingers, and I worry that I'll never be able to overcome it.""}
 {'from': 'gpt', 'value': ""I hear you, Charlie. Heartbreak can create a sense of emptiness and loss, but it's important to remember that healing takes time. Have you been able to explore your emotions and process your grief?""}
 {'from': 'human', 'value': ""I've tried, Alex. I've done everything I can think of to heal. I've journaled, talked to friends, and even tried new hobbies. But the pain is still there, lingering in the depths of my heart.""}
 {'from': 'gpt', 'value': ""It sounds like you've been proactive in your healing journey, Charlie. It's commendable that you've sought outlets to express your emotions and find support. Sometimes, despite our best efforts, healing takes longer than we anticipate. What specific aspects of your heartbreak have been most challenging for you?""}
 {'from': 'human', 'value': ""The most challenging part has been accepting that our relationship is truly over. I keep holding onto hope, even though deep down, I know it's time to let go. It's like my heart hasn't caught up with my mind.""}
 {'from': 'gpt', 'value': ""Letting go can be one of the hardest steps in the healing process, Charlie. It's understandable to hold onto hope when something was once so meaningful to you. Have you given yourself the space to grieve the loss of the relationship fully?""}
 {'from': 'human', 'value': ""I've tried, Alex, but I worry that fully embracing the grief will make it even more overwhelming. I'm scared that if I let myself feel it all, I won't be strong enough to move forward.""}
 {'from': 'gpt', 'value': ""It's natural to have those fears, Charlie, but sometimes acknowledging and fully feeling the grief can help you release its grip on you. Remember that strength isn't about avoiding emotions but acknowledging and moving through them. What are some self-care practices that bring you comfort during this challenging time?""}
 {'from': 'human', 'value': 'I find solace in nature, Alex. Taking long walks in the park and breathing in fresh air helps me clear my mind. I also try to practice mindfulness and focus on the present moment, reminding myself that one day this pain will pass.'}
 {'from': 'gpt', 'value': ""That's beautiful, Charlie. Nature can be a tremendous source of healing and grounding. Mindfulness can also help you cultivate resilience and find peace amidst the storm. Do you have a support system in place to lean on during this journey?""}
 {'from': 'human', 'value': 'Yes, Alex, I have friends who have been incredibly supportive. They listen without judgment and remind me of my strength when I doubt it. Their love and presence give me hope that brighter days are ahead.'}
 {'from': 'gpt', 'value': ""It's wonderful that you have such a loving support system, Charlie. Their presence can make a world of difference during times of heartbreak. As you continue to heal, have you thought about what you want for your future?""}
 {'from': 'human', 'value': ""I have, Alex, and it's a mix of scary and exciting. I'm hopeful that through this pain, I'll find a deeper understanding of myself and what I truly need in a healthy, fulfilling relationship. I want to grow and become the best version of myself.""}
 {'from': 'gpt', 'value': ""That's an inspiring perspective, Charlie. Heartbreak can be a catalyst for personal growth and self-discovery. It's beautiful that you're approaching this with hope and a desire to cultivate a better future. Remember, you're not alone on this journey, and I'm here to support you every step of the way.""}
 {'from': 'human', 'value': ""Thank you, Alex. Your support means everything to me right now. I'm ready to embrace the healing process, acknowledging my pain and grief with hope in my heart. I believe that brighter days are ahead, even in the midst of heartbreak.""}
 {'from': 'gpt', 'value': ""You're very welcome, Charlie. I'm honored to be part of your healing journey. Together, we'll navigate the depths of your emotions and celebrate the growth that lies ahead. Always remember that hope is a powerful force, capable of lighting up even the darkest corners of our lives. Together, we'll bring light to your heart.""}]",identity_4169
"[{'from': 'human', 'value': ""I'm feeling so stressed lately. I don't know what to do. Her dream come true feels further away than ever.""}
 {'from': 'gpt', 'value': ""It sounds like you're feeling overwhelmed. Can you tell me more about her dream come true?""}
 {'from': 'human', 'value': 'Her dream was to become a successful musician. She always longed to share her music with the world, but it feels like an impossible feat now.'}
 {'from': 'gpt', 'value': ""I can understand how discouraging that must feel. It's important to acknowledge those emotions. How long has she been pursuing her dream?""}
 {'from': 'human', 'value': 'She has been pursuing it for nearly a decade. She has faced countless rejections and setbacks, which have taken a toll on her confidence.'}
 {'from': 'gpt', 'value': ""It takes a lot of strength to keep going despite facing so many challenges. I'm curious, what does her dream represent to her?""}
 {'from': 'human', 'value': ""Her dream represents freedom and fulfillment. It's the expression of her truest self, and the belief that she can make a difference through her music.""}
 {'from': 'gpt', 'value': ""That's beautiful. It sounds like her dream holds a deep significance for her. Can you recall any specific moments where she felt close to making her dream come true?""}
 {'from': 'human', 'value': 'There was this one time when she performed at a small local venue. The crowd was mesmerized by her talent, and for a brief moment, she felt like she was on the right path.'}
 {'from': 'gpt', 'value': ""Those moments can be incredibly powerful. It's essential to hold onto them during challenging times. What obstacles does she perceive between her and her dream?""}
 {'from': 'human', 'value': 'She believes that she lacks the necessary connections and resources to break into the industry. It feels like an uphill battle with no end in sight.'}
 {'from': 'gpt', 'value': 'It can be challenging to navigate the industry without the right support. Have you both explored any potential resources or opportunities that could help her pursue her dream?'}
 {'from': 'human', 'value': 'We have tried networking, reaching out to industry professionals, and participating in local music events, but nothing seems to be yielding the results she had hoped for.'}
 {'from': 'gpt', 'value': 'I can understand her frustration. Sometimes the path to our dreams is filled with detours. Is there anything she could do differently to increase her chances of success?'}
 {'from': 'human', 'value': 'I think she could consider collaborating with other musicians or seeking mentorship from established artists. Maybe joining a band or forming her own could also provide more exposure.'}
 {'from': 'gpt', 'value': 'Those are great suggestions. Collaboration and mentorship can provide valuable guidance and expand her network. How do you think she would feel about exploring these options?'}
 {'from': 'human', 'value': ""I believe she would be open to exploring them. She's willing to try anything that might bring her closer to her dream.""}
 {'from': 'gpt', 'value': ""It's empowering to see her determination. Remind her that setbacks are not a reflection of her talent or worth. How can you support her during this challenging time?""}
 {'from': 'human', 'value': 'I can offer her emotional support, encourage her to keep going, and be her biggest cheerleader. Additionally, I could help her research potential opportunities and connect with other musicians.'}
 {'from': 'gpt', 'value': ""That's a wonderful way to support her. Remember that her journey is unique, and progress may not always be linear. How can she celebrate the small victories along the way?""}
 {'from': 'human', 'value': ""We can celebrate each step forward, no matter how small, with a special dinner or a meaningful gesture. It's important to acknowledge and appreciate the progress she's making.""}
 {'from': 'gpt', 'value': ""Absolutely. Celebrating milestones, no matter how minor, can bring a sense of accomplishment and motivation. Is there anything else she's struggling with that I can help with?""}
 {'from': 'human', 'value': ""She sometimes battles self-doubt and questions whether she's truly talented enough. How can she overcome these negative thoughts?""}
 {'from': 'gpt', 'value': ""It's common to have moments of self-doubt, but it's important to remind her of her unique gifts and the impact her art has on others. Encourage her to surround herself with positive influences and affirmations.""}
 {'from': 'human', 'value': ""I will definitely remind her of her worth and the positive impact she has on others. It's crucial to counteract those negative thoughts. Thank you for your guidance, Alex.""}
 {'from': 'gpt', 'value': ""You're welcome, Charlie. It's my pleasure to support you both. Remember, her dream is worth pursuing, and with resilience and the right mindset, she can make it come true. Keep supporting each other.""}]",identity_56239
"[{'from': 'human', 'value': ""I'm feeling incredibly regretful and isolated. It's like a heavy cloud has settled over me, suffocating any sense of joy or connection in my life. I can't help but wonder why my anxiety has taken such a hold on me, leaving me feeling so alone.""}
 {'from': 'gpt', 'value': ""Charlie, I can sense the depth of your pain, and I want you to know that I'm here for you. What specifically makes you feel regretful and isolated? Is there a particular event or circumstance that triggered these emotions?""}
 {'from': 'human', 'value': ""It's hard to pinpoint one specific thing. It's more like a constant stream of negative thoughts and worries that flood my mind. I regret not being able to handle situations like other people do. I feel isolated because I can't seem to escape this vicious cycle of anxiety and self-doubt.""}
 {'from': 'gpt', 'value': ""Your feelings are valid, Charlie. Anxiety can be incredibly overwhelming, and it's important to remember that you're not alone in this struggle. Have you tried any coping mechanisms or techniques to manage your anxiety?""}
 {'from': 'human', 'value': ""I've tried a few things, like deep breathing exercises and practicing mindfulness. While they provide some temporary relief, it's difficult to make them a sustainable part of my life. It feels like there's a constant battle going on inside me, and anxiety always seems to win.""}
 {'from': 'gpt', 'value': ""I understand how challenging it can be to incorporate new strategies into our daily routines, especially when we're feeling weighed down by anxiety. Perhaps we can explore different approaches that might resonate with you. Are there any activities or hobbies that you enjoy, even if anxiety often gets in the way?""}
 {'from': 'human', 'value': ""Well, I used to love painting and playing guitar, but lately, I haven't had the motivation or energy to engage in those activities. It's like anxiety has taken away the things that used to bring me joy, and now I'm left feeling empty and lost.""}
 {'from': 'gpt', 'value': 'It must be incredibly frustrating to have those activities that once brought you so much happiness feel out of reach. I wonder, is there anything about the painting or playing guitar that you miss the most?'}
 {'from': 'human', 'value': ""I miss the freedom and release that came with those creative outlets. Through painting, I could express my emotions without words, and with the guitar, I could lose myself in the music. They offered a temporary escape from reality, and that's something I long for now more than ever.""}
 {'from': 'gpt', 'value': ""It sounds like painting and playing guitar served as a form of self-expression and emotional release for you. Have you ever considered finding alternative ways to express yourself, even if they're different from what you used to do?""}
 {'from': 'human', 'value': ""I haven't really thought about it, to be honest. It feels like such a monumental task to find something that can bring me that same sense of release. But if there's a possibility, I'm open to exploring new avenues of self-expression.""}
 {'from': 'gpt', 'value': ""That's a wonderful mindset to have, Charlie. It takes courage and openness to step into the unknown and discover new ways to nourish your soul. Let's brainstorm together - are there any activities or interests you've been curious about or would like to try?""}
 {'from': 'human', 'value': ""I've always been drawn to writing, but I've never taken the time to explore it fully. Maybe writing could serve as an outlet for my emotions and offer the same sense of release as painting and playing guitar did.""}
 {'from': 'gpt', 'value': ""Writing can be an incredibly therapeutic and cathartic form of self-expression. It allows us to process emotions, gain insights, and find clarity. I encourage you to give it a try, even if it feels daunting at first. Remember, there's no right or wrong way to write - it's about connecting with yourself and finding what resonates with you.""}
 {'from': 'human', 'value': ""Thank you, Alex. Your words give me a glimmer of hope amidst the darkness I've been consumed by. I'll give writing a chance and see if it can become a new chapter of healing and self-discovery for me.""}
 {'from': 'gpt', 'value': ""You're welcome, Charlie. I'm here to support you every step of the way. Remember, healing takes time and patience, and it's okay to feel the intensity of your emotions. Trust yourself and the process, and know that brighter days are possible. Let's stay connected and continue exploring your journey towards healing.""}]",identity_55152
