conversations,id
"[{'from': 'human', 'value': ""I'm really struggling with a conflict I'm having with a friend in my life. It feels like our friendship is in jeopardy and it's affecting my emotional well-being. I never thought a friendship could be so complicated, especially when it comes to matters of the heart and marriage.""}
 {'from': 'gpt', 'value': ""Hi Charlie, I'm sorry to hear that you're feeling this way. Friendships can indeed be challenging at times, especially when they coincide with other important aspects of our lives. Could you tell me a little more about the conflict you're experiencing with your friend?""}]",identity_36646
"[{'from': 'human', 'value': ""Hey Alex, I'm feeling really stressed right now. I just went through a breakup and I need some guidance.""}
 {'from': 'gpt', 'value': ""Hey Charlie, I'm here for you. Breakups can be tough. Can you tell me a little more about what you're going through?""}]",identity_9443
"[{'from': 'human', 'value': ""Hi Alex, I hope you're doing well today. I'm feeling quite confident in myself and I wanted to discuss something that has been on my mind for quite some time - my dreams. You know, the dreams and aspirations I've always had but never really had the chance to pursue. I feel like now is the time to address them and see how I can make them a reality.""}
 {'from': 'gpt', 'value': ""Hello Charlie, I'm glad to hear you're feeling confident! It's wonderful that you're ready to explore your dreams and aspirations. Can you tell me a bit more about what these dreams involve?""}
 {'from': 'human', 'value': ""Certainly, Alex. One of my dreams is to travel and explore different cultures around the world. I've always been fascinated by the diversity of our planet and I feel like experiencing different cultures firsthand would be incredibly enriching. Another dream of mine is to write a book. I have so many stories and ideas swirling around in my head, and I feel a deep desire to share them with others. Lastly, I've always had a knack for art, and I would love to pursue painting and create pieces that evoke emotions and tell stories.""}
 {'from': 'gpt', 'value': ""That's fantastic, Charlie! It sounds like you have a wide range of dreams and each one holds a special place in your heart. I'm curious, what steps have you taken so far to make these dreams a reality?""}]",identity_95023
"[{'from': 'human', 'value': 'I feel lonely and filled with fear.'}
 {'from': 'gpt', 'value': ""Hey Charlie, I'm here to support you. It sounds like you're going through a difficult time. Can you tell me more about your conflict with friends?""}]",identity_11613
"[{'from': 'human', 'value': ""I can't believe it. I'm still in shock. The pain of rejection is overwhelming me right now. I never thought it would hurt this much.""}
 {'from': 'gpt', 'value': ""Charlie, I can sense the tension and heartache in your words. I'm here to listen and support you through this difficult time. Can you take a moment to reflect on what led to this rejection?""}]",identity_85782
"[{'from': 'human', 'value': ""Hey Alex, I hope this message finds you well. I've been struggling a lot lately, and I wanted to reach out because I'm feeling scared and overwhelmed by this addiction that has taken hold of my life. It's been a constant source of grief for me.""}
 {'from': 'gpt', 'value': ""Hi Charlie, thank you for reaching out. I'm so glad you've taken this step towards facing your fears and seeking support. I can understand how addiction can bring about these feelings of fear and grief. It's important to acknowledge and validate these emotions. Can you explain a bit more about what specifically scares you and what aspects of your life have been affected by this?""}
 {'from': 'human', 'value': ""Absolutely, Alex. I'm scared because I feel like I've lost control over my own choices and actions. It's overwhelming to realize how addiction has taken over every aspect of my life – my relationships, my work, and even my own sense of self. The sheer gravity of the grief I experience comes from knowing how much I've sacrificed and the pain I've caused myself and those around me.""}
 {'from': 'gpt', 'value': ""I appreciate you sharing your fears and the profound impact that addiction has had on your life, Charlie. It takes immense strength to confront these emotions and acknowledge the consequences that addiction can bring. Turning toward solutions, what are some positive changes you would like to see in your life moving forward? Are there any specific areas you'd like to focus on?""}
 {'from': 'human', 'value': ""Thank you, Alex. Moving forward, I'm dedicated to reclaiming control over my life and making positive changes. I would like to restore trust in my relationships, regain a sense of purpose and fulfillment in my work, and most importantly, I want to rediscover my true self – the person I was before addiction took hold. By focusing on these areas, I believe I can find the happiness and peace I deserve.""}
 {'from': 'gpt', 'value': ""Charlie, your commitment to reclaiming your life is truly inspiring. It's important to recognize that addiction does not define you and that your true self is still within you, waiting to be rediscovered. To support your journey, let's explore some practical strategies and resources that can help you navigate this path to recovery. Have you considered seeking professional help or joining support groups?""}]",identity_10380
"[{'from': 'human', 'value': ""Hi Alex, I hope you're having a great day! I wanted to talk to you about something that's been bugging me lately. You see, I've been feeling so insecure in my relationship with my boyfriend.""}
 {'from': 'gpt', 'value': ""Hello Charlie! Thank you for reaching out. I'm here to listen and help you navigate through this. Can you tell me more about what specifically is making you feel insecure in your relationship with your boyfriend?""}]",identity_49209
"[{'from': 'human', 'value': 'I feel insecure about my parenting.'}
 {'from': 'gpt', 'value': ""It sounds like you're struggling with your confidence as a parent. Could you tell me more about what makes you feel that way?""}]",identity_75018
"[{'from': 'human', 'value': 'I feel so unhappy, Alex. I desperately need a change in my life.'}
 {'from': 'gpt', 'value': ""Charlie, I hear the sadness in your words. I'm here to help you navigate through this difficult time. What specifically is making you feel unhappy?""}
 {'from': 'human', 'value': ""Well, I think my addiction is the root cause of my unhappiness. It's like a dark cloud that follows me everywhere, preventing me from finding true joy in life.""}
 {'from': 'gpt', 'value': ""Addiction can have a profound impact on our well-being, Charlie. It's courageous of you to acknowledge its presence. What kind of addiction are you struggling with?""}
 {'from': 'human', 'value': ""It's alcohol, Alex. I've been drowning my sorrows in it for years, and now it has taken control over my life. I want to break free from this cycle, but I feel helpless.""}
 {'from': 'gpt', 'value': ""Charlie, addiction can be an overwhelming battle, but remember that you are not alone in this journey. Allow yourself to feel the weight of this addiction, and let's work together to explore ways to reclaim control over your life. Have you considered seeking professional help?""}]",identity_59653
"[{'from': 'human', 'value': ""Hey Alex, I'm feeling really distracted and discouraged lately. It's like I can't focus on anything and it's affecting my daily life. Also, there's this ongoing bullying situation in my family that makes everything worse. I don't know what to do.""}
 {'from': 'gpt', 'value': ""Hi Charlie, I'm sorry to hear that you're feeling distracted and discouraged. Family conflict can be incredibly challenging and have a big impact on our well-being. Can you tell me a bit more about the bullying situation in your family?""}]",identity_68463
"[{'from': 'human', 'value': ""Hi Alex, I hope you're doing well. I'm feeling a little embarrassed about reaching out for therapy, but I know deep down that I really need some guidance. You see, I recently went through a breakup, and it has left me feeling lost and uncertain about the future. The breakup was with my long-term partner, and it has made me question everything, including my own ability to sustain a successful marriage.""}
 {'from': 'gpt', 'value': ""Hello Charlie, thank you for reaching out. Please know that you should never feel embarrassed about seeking therapy. It takes courage to ask for help, and I commend you for taking this step. Breakups can be incredibly difficult and can trigger a range of emotions. It's completely normal to question yourself and your future after such a significant loss. Let's explore your feelings and experiences together. Can you tell me a bit more about your relationship and what led to the breakup?""}
 {'from': 'human', 'value': 'Thank you, Alex, for your kind words. My relationship with my ex-partner was full of ups and downs, like any other, I suppose. We had our fair share of disagreements and challenges, but we always managed to work through them. However, over time, we started growing apart, and the spark that once ignited our love seemed to fade. We both realized that we had become different people with different needs and aspirations. It was a mutual decision to end things, as we felt it was for the best.'}
 {'from': 'gpt', 'value': ""I appreciate you sharing that, Charlie. It sounds like you and your ex-partner approached the breakup with maturity and respect for one another. Recognizing when a relationship is no longer fulfilling and making the difficult decision to end things can be a sign of personal growth. It's natural for relationships to evolve and for individuals to change over time. How have you been coping with the aftermath of the breakup?""}
 {'from': 'human', 'value': ""It hasn't been easy, Alex. There are days when I feel overwhelmed by a mix of sadness, hurt, and uncertainty. I find myself questioning whether I made the right decision or if I should have fought harder for the relationship. I often catch myself reminiscing about the good times we shared and feeling a sense of longing for what once was. However, there is also a glimmer of hope within me, a belief that this breakup is an opportunity for personal growth and finding a deeper happiness within myself.""}
 {'from': 'gpt', 'value': ""It's completely understandable to experience a range of emotions during this challenging time, Charlie. The decision to end a relationship is never easy, and it's natural for doubts and regrets to arise. However, it's important to remember that growth often comes from challenging experiences like this. You mentioned a glimmer of hope within you, which suggests an underlying resilience. How do you envision this breakup becoming an opportunity for personal growth?""}]",identity_960
"[{'from': 'human', 'value': ""I'm feeling really worried and isolated lately. It's like I can't escape these feelings no matter what I do.""}
 {'from': 'gpt', 'value': ""I'm sorry to hear that you're feeling this way, Charlie. Can you tell me more about what's been going on in your life lately that might be contributing to these feelings?""}]",identity_16643
"[{'from': 'human', 'value': ""I just don't understand why my family can't have peaceful communication. It feels like we're always at each other's throats.""}
 {'from': 'gpt', 'value': 'Hi Charlie, thank you for sharing your thoughts. It sounds really challenging to constantly experience conflict within your family. Can you tell me more about these communication issues?'}]",identity_73829
"[{'from': 'human', 'value': ""Hey Alex, I need someone to talk to. It's about my friend... or should I say, my ex-boyfriend.""}
 {'from': 'gpt', 'value': ""Hi Charlie, I'm here to listen. Tell me more about your friend, or rather your ex-boyfriend. What's been going on?""}]",identity_10269
"[{'from': 'human', 'value': ""Hey Alex, I hope you're doing well today. I'm feeling a little bit all over the place, but also excited to be here. I've been struggling with addiction for a while now, and it's really starting to take a toll on me. There's this constant insecurity that I can't seem to shake off, like I'm not in control of my own life anymore.""}
 {'from': 'gpt', 'value': ""Hello Charlie, it's great to have you here. I appreciate your honesty and willingness to share. I can understand how difficult it must be to carry that sense of insecurity with you. Addiction can be a powerful force that can make us feel like we've lost control. Could you tell me more about your experiences with addiction? I'm curious to understand what you've been going through.""}
 {'from': 'human', 'value': ""Thank you, Alex. It means a lot to have someone who wants to listen and understand. Well, it all started a few years back when I was going through a difficult time in my life. I found solace in substances, thinking they would help me escape my problems. But instead, they became my biggest problem. I've tried so many times to kick the habit, but it feels like I always fall back into the same pattern. It's like I'm trapped in a never-ending cycle, and that's where the insecurity seeps in.""}
 {'from': 'gpt', 'value': ""Charlie, I'm here to support you on this journey. Addiction is indeed a challenging cycle to break, and it's commendable that you've tried before. The fact that you're seeking help shows tremendous strength and hopefulness. Could you share more about what triggers your addiction? Understanding the patterns and underlying causes can give us a foundation to work on.""}
 {'from': 'human', 'value': ""Absolutely, Alex. There are a few triggers that I've noticed. Stressful situations tend to make me reach out for something to numb the pain or escape temporarily. It's like I crave that instant relief, even though I know deep down that it's not a sustainable solution. Also, being around certain people or environments that remind me of my past substance use can intensify those cravings. It's a constant battle between the rational part of my brain and the overwhelming desire to use again.""}
 {'from': 'gpt', 'value': ""Thank you for sharing, Charlie. It takes a lot of self-awareness to recognize these triggers. It's completely understandable to seek relief when faced with stress or reminders of past substance use. Building healthy coping mechanisms can help you navigate these challenging moments. What are some activities or strategies that you find helpful when faced with triggers?""}]",identity_44649
"[{'from': 'human', 'value': ""I'm feeling really nervous about my marriage.""}
 {'from': 'gpt', 'value': ""I can see that you're feeling anxious. Can you tell me more about what specifically is making you nervous?""}]",identity_29037
"[{'from': 'human', 'value': ""Hi Alex, I hope you're doing well. I've been feeling really anxious lately and I don't know what to do about it. My friend mentioned that therapy might help, so here I am pouring my heart out to you. My anxiety is affecting my daily life, my relationships, and even my ability to function properly. It's like a dark cloud that never seems to go away. And to make matters worse, it's starting to take a toll on my relationship with my husband. I just don't know how to handle it anymore.""}
 {'from': 'gpt', 'value': ""Hi Charlie, thank you for reaching out and trusting me. I'm really sorry to hear that you're experiencing so much anxiety, and I can understand how overwhelming it must be for you. It sounds like it's impacting various aspects of your life, including your relationship with your husband. Can you tell me more about how your anxiety is affecting your relationship?""}
 {'from': 'human', 'value': ""Well, Alex, my husband is a loving and supportive person, but my constant worry and unease make it hard for me to fully engage with him. I find myself becoming irritable and snapping at him over minor issues. I know it's not fair to him, but it's like I can't control it. Sometimes I even push him away because I'm afraid he'll see me at my worst and leave me. I'm scared that my anxiety, my constant companion, will ruin our marriage.""}
 {'from': 'gpt', 'value': ""It seems like your anxiety is causing a lot of strain within your relationship, Charlie. It's understandable that you're worried about the impact it may have. How does your husband respond when you push him away or display signs of anxiety? Have you talked to him about your fears and concerns?""}
 {'from': 'human', 'value': ""My husband is really understanding, Alex, and he tries his best to support me. He's patient and always reassures me that he's here for me. But it feels like this constant cycle of anxiety is wearing him down too. Sometimes he withdraws, thinking it's better to give me space, while other times he gets frustrated because he doesn't know how to help me. I have talked to him about my fears and concerns, and he listens, but I can tell it weighs on him too. I just want us to be happy together and not let my anxiety consume us.""}
 {'from': 'gpt', 'value': ""It sounds like your husband truly cares about you, Charlie, and his support is invaluable. It's important to keep the lines of communication open and continue having those honest conversations with him. Have you considered seeking professional help together or explored any coping mechanisms that could potentially alleviate some of your anxiety symptoms?""}]",identity_90796
"[{'from': 'human', 'value': ""Hey Alex, it's Charlie. I've been feeling really discouraged lately, like a weight is constantly pressing down on me. The family conflict I'm going through is so painful, and I don't know how to handle the pressure anymore.""}
 {'from': 'gpt', 'value': ""Hi Charlie, I'm here for you. It sounds like you're carrying a heavy burden. Family conflicts can be incredibly challenging and overwhelming. Can you tell me more about the specific situation that is causing you so much pain and pressure?""}
 {'from': 'human', 'value': ""It all started a few months ago when my parents started arguing all the time. Their constant fighting creates this tense atmosphere at home, and it feels like I'm walking on eggshells. I try to stay neutral, but I'm caught in the middle and it's tearing me apart.""}
 {'from': 'gpt', 'value': ""It must be incredibly difficult to witness your parents going through such turmoil. Feeling caught in the middle can be very painful, especially when you're trying to balance your loyalty to both of them. How does this conflict impact you on a daily basis?""}
 {'from': 'human', 'value': ""It's like a never-ending emotional rollercoaster, Alex. I wake up every morning with a sense of dread, not knowing what to expect. I can't concentrate on anything else, and it's affecting my work, my relationships, and even my sleep. I feel stuck and helpless.""}
 {'from': 'gpt', 'value': 'I can sense the profound impact this is having on your overall well-being, Charlie. When family conflict becomes all-encompassing, it can be overwhelming to the point where it infiltrates every aspect of our lives. Have you been able to communicate your feelings to your parents?'}]",identity_14074
"[{'from': 'human', 'value': ""I'm so confused, Alex. I don't understand why I feel this way. It's like my heart is breaking into a million pieces. I trusted them completely, and they cheated on me. I feel lost and hurt.""}
 {'from': 'gpt', 'value': ""Charlie, I'm here for you, and I want you to know that you're not alone in this. Heartbreak can be incredibly painful, and it's normal to feel confused when someone we trusted betrays us. What would you like to talk about first?""}]",identity_95808
"[{'from': 'human', 'value': ""I feel so embarrassed about this, but I can't help but admit that I've been experiencing a lot of work-related stress lately. It's been making me feel isolated from everyone around me.""}
 {'from': 'gpt', 'value': ""Hi Charlie, thank you for sharing. I'm here to listen and understand. Work-related stress can be tough, and it's not uncommon to feel isolated in such situations. Can you tell me more about what's been causing you stress at work?""}
 {'from': 'human', 'value': ""It's just the constant pressure to meet deadlines and exceed expectations. I always feel like I'm falling short, and it weighs me down.""}
 {'from': 'gpt', 'value': 'It sounds like the expectations placed on you at work are overwhelming. How do you cope with this pressure?'}
 {'from': 'human', 'value': ""Honestly, I haven't been coping well. I've been isolating myself even more, trying to hide my struggles from my colleagues and friends. I don't want to burden them.""}
 {'from': 'gpt', 'value': ""I understand that you feel the need to protect others, but isolating yourself might not be the best way to deal with the stress. It's important to remember that you don't have to face this alone. Have you considered reaching out for support?""}]",identity_6684
"[{'from': 'human', 'value': ""I can't help but feel guilty about something that happened with her.""}
 {'from': 'gpt', 'value': ""Hi Charlie, thank you for reaching out to me. I'm here to listen and support you. Can you tell me more about what happened with her?""}]",identity_67111
"[{'from': 'human', 'value': ""I am grateful for this opportunity to share my experiences, Alex. Lately, I've been dealing with some conflict with my friends, and it's been quite traumatic for me.""}
 {'from': 'gpt', 'value': 'Thank you for opening up, Charlie. It takes courage to recognize and address conflicts within our friendships. Could you please share a bit more about the nature of these conflicts?'}]",identity_27312
"[{'from': 'human', 'value': ""I've been feeling really anxious lately, especially when it comes to conflicts with my friends. It's been affecting my ability to focus at work.""}
 {'from': 'gpt', 'value': ""Hi Charlie, thank you for reaching out. I'm here to listen and understand what's been going on. Could you tell me more about the conflicts you've been experiencing with your friends?""}
 {'from': 'human', 'value': ""Well, it seems like we're constantly at odds lately. We have different opinions on various topics, and it's causing tension within our group. It's hard for me to navigate these conflicts and find a resolution.""}
 {'from': 'gpt', 'value': ""I can imagine that must be challenging. It's tough when you find yourself disagreeing with your friends. How does this conflict impact your work? Do you find it difficult to concentrate or does it weigh on your mind?""}
 {'from': 'human', 'value': ""Yes, exactly. The conflict and tension are constantly on my mind, making it difficult for me to stay focused and give my best at work. I'm constantly worrying about how things will play out and if it will impact our friendship in the long run.""}
 {'from': 'gpt', 'value': ""It's understandable that these conflicts are causing you anxiety and affecting your ability to concentrate on your work. Have you tried any strategies or approaches to address these conflicts with your friends?""}]",identity_49359
"[{'from': 'human', 'value': ""I don't know where to start, Alex. Lately, I've been feeling so disgusted and betrayed. It all started when I came across a new hobby that I thought would bring me joy and fulfillment. But instead, it made me feel empty and disappointed.""}
 {'from': 'gpt', 'value': 'I can sense your frustration, Charlie. It must be challenging when something you hoped would bring positivity into your life ends up making you feel this way. Can you tell me more about this new hobby that has brought about these emotions?'}
 {'from': 'human', 'value': ""Well, you see, Alex, I've always been a fan of painting. The thought of expressing myself on a canvas seemed so liberating. But when I started attending art classes, I realized it wasn't as enjoyable as I had anticipated. The atmosphere was stifling, and the pressure to produce masterpieces overwhelmed me.""}
 {'from': 'gpt', 'value': ""It sounds like this experience with the art classes has been disappointing and disheartening for you. Sometimes, when we have high expectations, it can be a letdown when reality doesn't align with them. How did you feel when you noticed these feelings of disgust and betrayal creeping in?""}
 {'from': 'human', 'value': 'Initially, Alex, I felt frustrated with myself. I thought I was failing at something I used to love. But soon, the frustration turned into sadness, and I started questioning my own abilities and passions. I felt a sense of betrayal towards myself, as if I had abandoned the part of me that used to find solace in art.'}
 {'from': 'gpt', 'value': ""It's natural to feel disappointed and question your abilities when a beloved hobby doesn't bring the expected joy. However, I want you to know that it doesn't mean you've abandoned that part of you. Our interests and passions evolve over time, and it's okay to explore new avenues. Did you consider exploring any other hobbies or creative outlets?""}]",identity_25243
"[{'from': 'human', 'value': ""I've been feeling really anxious and lonely lately. It's like I'm surrounded by people, but I still feel so alone. I don't know what to do anymore.""}
 {'from': 'gpt', 'value': ""I'm sorry to hear that you're feeling this way, Charlie. Loneliness and anxiety can definitely be difficult emotions to deal with. Can you tell me more about what specifically makes you feel lonely?""}]",identity_87465
"[{'from': 'human', 'value': 'I feel so insecure and like a failure.'}
 {'from': 'gpt', 'value': ""Hello Charlie, thank you for sharing your feelings. I'm here to support you. Can you tell me more about why you're feeling insecure and like a failure?""}]",identity_588
