conversations,id
"[{'from': 'human', 'value': ""Hi Alex, I hope you're doing well today. I've been struggling with anxiety lately, and I could really use your support and guidance. You see, I've always been a bit shy and self-doubting, but recently I started dating this incredible woman. She's my girlfriend now, and I want to be confident in our relationship.""}
 {'from': 'gpt', 'value': ""Hello Charlie, I'm here to support you on your journey towards building confidence and maintaining a healthy relationship. It's great to hear that you've found someone special in your life. Let's explore your anxiety together. Can you tell me more about the specific situations or thoughts that trigger your anxious feelings?""}
 {'from': 'human', 'value': ""Thank you, Alex. Well, it's mainly when we're surrounded by a large group of people. Whenever we attend social events or parties together, I start to feel overwhelmed by a fear of judgment. I worry about saying the wrong thing or not being interesting enough for her. It's like a storm of self-doubt brewing inside me.""}
 {'from': 'gpt', 'value': ""I hear you, Charlie. It's understandable that such situations can be challenging for anyone, and it's natural to feel anxious about how we come across to others. Remember, creating a safe space for vulnerability and open communication in your relationship can help ease some of these worries. Have you discussed your anxiety with your girlfriend?""}
 {'from': 'human', 'value': ""Yes, Alex, I've opened up to her about my anxiety, and she has been incredibly understanding and supportive. She reassures me that she loves me just the way I am. But sometimes, the fear still lingers, and I don't want it to affect our relationship. I want to be the best partner I can be.""}
 {'from': 'gpt', 'value': ""That's wonderful, Charlie. It's great to have someone who understands your struggles and supports you unconditionally. It sounds like your girlfriend appreciates you for who you are, anxiety and all. In addition to open communication, have you considered utilizing any relaxation techniques or coping strategies when you feel overwhelmed at social events?""}
 {'from': 'human', 'value': ""Yes, I've tried deep breathing exercises and finding a quiet corner when I need a moment alone. They do help to some extent, but I still find it challenging to fully relax and enjoy the moment. It feels like anxiety creeps back in, trying to steal my confidence.""}
 {'from': 'gpt', 'value': ""It's important to acknowledge that anxiety may take time to fully overcome, Charlie. It's a journey rather than a quick fix. Remember to be patient and kind to yourself throughout this process. Alongside relaxation techniques, have you considered exploring any mindfulness or self-compassion exercises? They can be powerful tools for managing anxiety and cultivating confidence.""}
 {'from': 'human', 'value': ""That's a great suggestion, Alex. I haven't explored mindfulness or self-compassion exercises extensively, but I'm willing to give them a try. Do you have any recommendations for specific practices or resources that could help me on this path?""}
 {'from': 'gpt', 'value': 'Absolutely, Charlie. Mindfulness meditation can be a powerful tool for managing anxiety. It involves focusing your attention on the present moment without judgment. You can start with short sessions, just a few minutes a day, and gradually increase the duration as you become more comfortable. There are also many mindfulness apps and guided meditation recordings available that you can incorporate into your routine. Would you like me to provide some recommendations?'}
 {'from': 'human', 'value': 'Yes, please, Alex. I would appreciate any resources you can suggest. I am eager to incorporate mindfulness into my life and learn how to show myself more compassion.'}
 {'from': 'gpt', 'value': ""Of course, Charlie. I'll gather some helpful resources for you and share them in our next session. Remember, building confidence is a process, and it takes time, patience, and self-compassion. I'm proud of you for taking these steps towards self-growth and nurturing your relationship. Is there anything else you'd like to discuss today?""}]",identity_12951
"[{'from': 'human', 'value': 'I must say, Alex, I am relieved to finally be sitting here with you today. I have been carrying this weight of worry regarding my health issues for far too long. My main goal here is to find a sense of understanding and hopefully some guidance on how to navigate this journey towards better well-being.'}
 {'from': 'gpt', 'value': ""Thank you for sharing, Charlie. I am here to support you wholeheartedly. It's completely understandable to feel relieved when we finally make the decision to seek help. Let's start by exploring your health concerns. What specific issues have been bothering you?""}
 {'from': 'human', 'value': ""Well, Alex, my goals mainly revolve around managing my chronic back pain and finding ways to improve my overall physical fitness. I've been experiencing this discomfort for quite some time, and it's starting to impact my daily life. Additionally, I'd like to understand the root cause of this pain and learn how to prevent it from worsening.""}
 {'from': 'gpt', 'value': ""Your goals are well-defined, Charlie. It's commendable that you're actively seeking ways to address your back pain and enhance your fitness level. Before we dive deeper, I want to acknowledge the courage it takes to embark on this journey. Now, let's explore the symptoms you've been experiencing. When did the back pain first start, and how would you describe its intensity?""}
 {'from': 'human', 'value': ""Thank you for your kind words, Alex. It started about a year ago after I had a minor fall. The intensity can vary, but it's usually a dull ache that escalates when I engage in physical activities such as lifting heavy objects or standing for prolonged periods. Sometimes it radiates down my legs, making it difficult to walk comfortably.""}
 {'from': 'gpt', 'value': ""I appreciate you sharing those details, Charlie. It appears that your back pain is mainly triggered by certain movements or prolonged periods of standing. Has there been any specific treatment or interventions you've tried so far? It could give us valuable insights into what has worked or hasn't worked in the past.""}
 {'from': 'human', 'value': ""Yes, Alex, I've tried a few things to alleviate the pain. I've experimented with different over-the-counter painkillers, used heating pads, and even attempted some stretches I found online. While these provided temporary relief, none of them seemed to address the root cause or provide long-lasting results. That's why I'm here, hoping to gain a deeper understanding of my situation.""}
 {'from': 'gpt', 'value': ""I completely understand, Charlie. It's essential to identify the underlying cause rather than just treating the symptoms. In our sessions, we can explore various therapeutic approaches tailored specifically to you. Additionally, we can discuss the importance of lifestyle modifications and how they can positively impact your overall fitness goals. Are you open to exploring these options?""}
 {'from': 'human', 'value': ""Absolutely, Alex. I'm willing to try anything that will help me regain control of my physical health. I believe a holistic approach focused on understanding the root cause and making sustainable lifestyle changes will be the most effective in the long run. I'm fully committed to putting in the work and following your guidance.""}
 {'from': 'gpt', 'value': ""That's wonderful to hear, Charlie. Your dedication and commitment will play a vital role in your healing process. Alongside our sessions, I encourage you to keep a journal where you can track your symptoms, triggers, and any patterns you notice. This will assist us in identifying potential triggers, understanding the impact of certain activities, and tailoring our treatment plan accordingly. How does that sound to you?""}
 {'from': 'human', 'value': ""I think that's a fantastic idea, Alex. A journal will allow me to track my progress and provide us with valuable insights. I'm glad to have your guidance throughout this journey. Your thoughtful approach and emphasis on understanding the root cause truly resonate with me. I'm ready and excited to get started on this path towards better health.""}
 {'from': 'gpt', 'value': ""I'm glad to hear that, Charlie. Remember, progress takes time and patience. I'll be here every step of the way, offering support and helping you explore different strategies. Together, we will work towards your goals and empower you to regain control of your physical well-being. Is there anything else you would like to discuss or any questions you have before we conclude our session today?""}
 {'from': 'human', 'value': ""No, Alex, I think we've covered everything for now. I'm grateful for the opportunity to share my concerns and goals with you. This conversation has provided me with a newfound sense of hope and direction. I look forward to our next session and the progress we will make together. Thank you for being such a compassionate and understanding therapist.""}
 {'from': 'gpt', 'value': ""You're most welcome, Charlie. It's my privilege to be a part of your healing journey. Remember, I'm here for you, and we will navigate this path together. Until our next session, take care and be kind to yourself. You've already taken the first essential step towards a healthier and happier you.""}]",identity_37222
"[{'from': 'human', 'value': ""I just feel so overwhelmed, Alex. It's like this weight on my chest that I can't escape. And to make it worse, I keep facing criticism from everyone around me. I don't know how to deal with it all.""}
 {'from': 'gpt', 'value': ""Charlie, I can sense the heaviness in your words. It must be incredibly challenging to navigate these feelings of overwhelm and constant criticism. Can you tell me more about what's been going on?""}
 {'from': 'human', 'value': ""It's my addiction, Alex. It's consuming my life. I can't seem to break free from its grip no matter how hard I try. And every time I stumble, I face judgment and criticism from my loved ones. It's hard not to take it personally.""}
 {'from': 'gpt', 'value': ""Addiction is a powerful force, Charlie, and it's not surprising that it feels overwhelming. Can you help me understand what led to the addiction and how it's affecting your daily life?""}
 {'from': 'human', 'value': ""It all started with trying to numb my pain, Alex. Life just felt too heavy, and I turned to substances as an escape. But now, it's taken over. I can't function without it, and I've lost sight of who I used to be. The criticism only reinforces the shame and guilt I already feel.""}
 {'from': 'gpt', 'value': ""It sounds like addiction has become a coping mechanism for you, Charlie, a way of avoiding your pain. I want you to know that I'm here to support you without judgment. Can you share more about how addiction has impacted your relationships and sense of self?""}
 {'from': 'human', 'value': ""My relationships have suffered greatly, Alex. The people who care about me are disappointed and angry, and I don't blame them. It's hard to maintain trust when addiction is in the picture. As for my sense of self, it's eroded. I don't recognize the person I've become, and I constantly criticize myself for giving in to the addiction.""}
 {'from': 'gpt', 'value': ""Addiction can take a toll on both our inner world and our external connections, Charlie. It's normal to feel that self-criticism, but remember that healing is possible. Let's explore what support systems you have in place and how you can rebuild a positive sense of self.""}
 {'from': 'human', 'value': ""I do have a few supportive friends, Alex, who have stuck with me through thick and thin. But it's hard to rely on them all the time. I often isolate myself, feeling like a burden. Rebuilding a positive sense of self feels daunting. Can you offer any guidance?""}
 {'from': 'gpt', 'value': ""Your friends sound like treasures, Charlie, and it's wonderful that you have them. Remember, you don't have to face this alone. Therapy is a powerful tool for recovery, and we can work together to build a stronger foundation for your sense of self-worth. How does that sound to you?""}
 {'from': 'human', 'value': ""I'm willing to try anything at this point, Alex. I want to move past this addiction and find my true self again. If therapy can provide that guidance and support, then I'm all for it.""}
 {'from': 'gpt', 'value': ""Charlie, your willingness to explore new avenues of support is commendable. Throughout this journey, it's crucial to remember that healing takes time. Together, we'll focus on solutions and challenges, guiding you towards a place of self-discovery and recovery. Are you ready to embark on this transformative process?""}]",identity_40508
"[{'from': 'human', 'value': ""Hi Alex, I hope you're doing well. I decided to reach out because I've been feeling lost and down lately. You see, I recently went through a breakup and it's been tough for me to cope with everything on my own.""}
 {'from': 'gpt', 'value': ""Hello Charlie, I'm glad you reached out. I'm here to listen and help you navigate through this challenging time. Breakups can be incredibly difficult, so it's understandable that you're feeling lost. Can you tell me more about what you're experiencing?""}
 {'from': 'human', 'value': ""Well, after the breakup, I've been feeling like a piece of me is missing. I used to rely on my partner for support and now I have to find my own way. It's hard to adjust to this new reality.""}
 {'from': 'gpt', 'value': ""It sounds like you're going through a major transition in your life. Losing a significant relationship can leave a void, and adjusting to being single can take time. How have you been taking care of yourself since the breakup?""}
 {'from': 'human', 'value': ""I've been trying my best to stay positive and focus on my health. I've been exercising regularly and eating well. It helps boost my mood and gives me a sense of control over my life. I've also started journaling to express my emotions.""}
 {'from': 'gpt', 'value': ""That's great, Charlie! Taking care of your physical health can have a positive impact on your emotional well-being. Journaling is a fantastic way to process your emotions and gain clarity. Have you noticed any changes in your overall health since you started these activities?""}
 {'from': 'human', 'value': ""Definitely, Alex! I feel more energized and overall happier. Engaging in these healthy habits has been empowering, and it's given me a sense of direction during this confusing time. I'm starting to regain my confidence and find comfort in my own company.""}
 {'from': 'gpt', 'value': ""It's wonderful to hear that you're experiencing positive changes. Building self-confidence and finding comfort in solitude are essential steps towards personal growth. Have you considered exploring any therapeutic techniques or strategies during this healing process?""}
 {'from': 'human', 'value': ""I haven't really thought about it yet, but I'm open to exploring different approaches. What would you recommend, Alex?""}
 {'from': 'gpt', 'value': 'Well, based on your psychodynamic style, exploring your past experiences and how they may have influenced your relationships could be beneficial. Additionally, cognitive-behavioral techniques can help you challenge any negative thoughts or beliefs that may be hindering your progress. Would you be interested in delving into these areas during our sessions?'}
 {'from': 'human', 'value': ""That sounds interesting, Alex. I'm definitely open to exploring my past and rewiring any negative thoughts. I want to grow and heal from this breakup. I believe it's important to embrace self-discovery and work towards a healthier future.""}
 {'from': 'gpt', 'value': ""That's a great mindset to have, Charlie. It takes courage to dive into our past and confront our inner demons. Remember, therapy is a safe space for you to explore these emotions and find new ways of relating to yourself and others. I truly believe in your ability to heal and create a brighter future.""}
 {'from': 'human', 'value': ""Thank you, Alex. Your belief in me means a lot. I'm ready to embark on this journey of self-discovery and healing. I know it won't be easy, but with your guidance, I'm optimistic about the positive changes that lie ahead.""}
 {'from': 'gpt', 'value': ""You're welcome, Charlie. I'll be here every step of the way, supporting and guiding you as you navigate through this process. Remember, healing takes time, but with a positive mindset and the right tools, you can overcome any obstacles that come your way. I'm excited to see the progress you'll make on this transformative journey.""}]",identity_75496
"[{'from': 'human', 'value': ""Hi Alex, I just need to get this off my chest. I've been feeling so exhausted lately, and it's really starting to affect my work. I feel like I'm always trying to keep up, but I just can't catch a break. It's frustrating because I used to love my job, but now it's starting to feel like a chore. I'm feeling like I'm cheating myself out of the enjoyment I used to have.""}
 {'from': 'gpt', 'value': ""Hi Charlie, thank you for reaching out. I can hear the fatigue and disappointment in your words. It must be challenging to go through this when work used to bring you joy. Can you tell me more about what specifically is causing you to feel so exhausted and like you're cheating yourself?""}
 {'from': 'human', 'value': ""Well, Alex, it's a combination of things. First of all, the workload has increased dramatically recently. I'm constantly juggling numerous projects and deadlines, and it feels like there's never enough time to finish everything. It's hard to keep up with the demands, and it feels like I'm always behind. Secondly, I've noticed a shift in the work culture. There's this constant pressure to stay connected and available at all times, even outside of regular working hours. I can't seem to find a healthy work-life balance anymore. It's overwhelming.""}
 {'from': 'gpt', 'value': ""That sounds incredibly challenging, Charlie. It must be quite exhausting to feel like you're constantly playing catch-up and not having time for yourself. Have you had a chance to express your concerns about the increased workload and the impact it's having on your work-life balance to your supervisor or anyone else at work?""}
 {'from': 'human', 'value': ""I haven't really talked about it yet, Alex. I guess I've been hesitant because I don't want to come across as weak or incapable. I want to prove that I can handle it all and that I'm competent. But the truth is, I'm getting burned out.""}
 {'from': 'gpt', 'value': ""It's understandable that you feel hesitant, Charlie. Many people struggle with asking for support or expressing their needs at work. It takes courage to acknowledge the toll it's taking on you. Remember, reaching out for help isn't a sign of weakness; it's a sign of strength and self-awareness. Is there someone you trust at work who you could consider sharing your concerns with?""}
 {'from': 'human', 'value': ""I do have a colleague who I'm close with, Alex. We often chat and share our frustrations. Maybe it's time I open up to them about what I've been going through. It might bring some relief to have someone who understands and can provide support.""}
 {'from': 'gpt', 'value': ""That sounds like a positive step, Charlie. Having someone who can empathize with what you're experiencing can make a tremendous difference. It allows for a supportive connection and brings a sense of shared understanding. How would you feel about reaching out to your colleague and discussing your work-related stress together?""}
 {'from': 'human', 'value': ""I feel hopeful, Alex. I think we could lean on each other and come up with strategies to manage our workloads better. It would be comforting to know that I'm not alone in this. Maybe we can even approach our supervisor together to address some of the concerns we both have.""}
 {'from': 'gpt', 'value': ""That sounds like a proactive plan, Charlie. Collaborating with your colleague and approaching your supervisor together shows initiative and a willingness to improve your work environment. It could pave the way for positive changes and better communication within your workplace. Remember, you deserve a healthy work-life balance and support from your team. Is there anything else on your mind regarding your work-related stress that you'd like to discuss?""}
 {'from': 'human', 'value': ""I think for now, Alex, this feels like a good starting point. Taking that first step to reach out to someone feels empowering. I'm already feeling a little lighter just from sharing my thoughts with you. Thank you for listening and offering guidance. I'm looking forward to making positive changes moving forward.""}
 {'from': 'gpt', 'value': ""You're most welcome, Charlie. It's an honor to be a part of your journey towards finding balance and joy in your work again. Remember, the path to improvement starts with acknowledging your needs and seeking support. I'm here for you every step of the way. Don't hesitate to reach out whenever you need to. Take care and be gentle with yourself as you navigate through this process.""}]",identity_27488
"[{'from': 'human', 'value': ""I'm feeling so lost, Alex. My world has come crashing down. I never imagined I'd be here, facing this heart-wrenching breakup. I'm overwhelmed by a mix of emotions right now, but mostly sadness. It's suffocating me, and I don't know how to move forward. I feel a sense of panic setting in, like I've lost a big part of myself.""}
 {'from': 'gpt', 'value': ""I'm sorry to hear you're going through such a difficult time, Charlie. Breakups can be incredibly challenging, and it's natural to feel overwhelmed and lost. Take a deep breath and know that I'm here to support you. Can you tell me more about what happened in the relationship?""}
 {'from': 'human', 'value': ""It's hard to put into words, but our once-loving partnership has crumbled into bits and pieces. We drifted apart, and the love that once held us together slowly faded away. It feels like a cruel twist of fate, leaving me longing for something that's now out of reach. How do I cope with this heartache, Alex?""}
 {'from': 'gpt', 'value': ""It's painful when love slips away, Charlie, and I can sense the depth of your sadness. Coping with heartbreak takes time and self-compassion. Have you allowed yourself to grieve the loss? Understanding your emotions can be a crucial step in the healing process.""}
 {'from': 'human', 'value': ""Yes, Alex. I've been trying to embrace the sadness and surrender to the pain. It's a rollercoaster of emotions, but I acknowledge that it's part of my journey towards healing. Some days, I'm able to release the tears, while others, I feel numb. Is that normal?""}
 {'from': 'gpt', 'value': ""Absolutely, Charlie. Grief doesn't follow a linear path, and it's completely normal to experience both intense emotions and moments of emotional numbness. Allow yourself to feel whatever comes up for you, without judgment. Are there specific challenges you're encountering while navigating this breakup?""}
 {'from': 'human', 'value': ""One of the toughest challenges has been accepting the reality that this relationship, which held so much promise, has come to an end. It's hard to let go of the memories, the shared dreams, and the love we once had. I find myself clinging to what used to be, afraid of moving forward without them.""}
 {'from': 'gpt', 'value': ""Letting go is undoubtedly difficult, Charlie. It's understandable that you're feeling apprehensive about the future without your ex-partner. Can you think of any specific beliefs or fears that might be holding you back from embracing the process of moving on?""}
 {'from': 'human', 'value': ""I guess one of my biggest fears is that I won't find love again. Deep down inside, I question myself and wonder if I'm meant to be alone. It's scary to imagine a future without the warmth and connection I once had. How do I overcome this fear, Alex?""}
 {'from': 'gpt', 'value': ""Fear of being alone and never finding love again is a common concern, Charlie. It's important to remember that your worth isn't defined by a romantic relationship. Building a fulfilling and loving life for yourself is possible, and it starts with cultivating self-love and self-compassion. Have you explored ways to reconnect with yourself and foster self-care during this challenging time?""}
 {'from': 'human', 'value': ""I've been trying, Alex. I've been immersing myself in activities that bring me joy, like painting and going for long walks in nature. It helps momentarily, but deep down, there's still an ache. Sometimes, I catch myself yearning for their presence, wishing things could go back to how they were. How do I let go of this attachment, Alex?""}
 {'from': 'gpt', 'value': ""It's understandable that there's still an ache, Charlie. Letting go of attachment takes time and patience. Along with engaging in activities that bring you joy, it might be helpful to practice mindfulness and gently observe these thoughts and yearnings without judgment. Acknowledge them and let them pass, knowing that true healing lies in embracing the present moment and what the future might hold.""}]",identity_12498
