conversations,id
"[{'from': 'human', 'value': ""I don't know, Alex. Lately, I've been feeling numb, like I'm just going through the motions of life. No matter what I do, I can't seem to shake this heaviness that's weighing me down.""}
 {'from': 'gpt', 'value': ""I'm sorry to hear that, Charlie. It sounds like you're really struggling right now. Let's take some time to explore what might be contributing to this numbness. Can you share a little more about what's been going on in your life recently?""}
 {'from': 'human', 'value': ""Well, it all started when he left. He was the one who brought excitement and joy into my life. Without him, everything feels colorless and dull. I've been trying to fill that void with different activities, but nothing seems to stick.""}
 {'from': 'gpt', 'value': ""It's understandable that losing someone who brought such brightness to your life would leave you feeling disheartened. Exploring new hobbies can be a great way to discover new sources of joy and fulfillment. Have you tried any new activities since he left?""}
 {'from': 'human', 'value': ""I have tried a few things, but I can't seem to find anything that captivates me like he did. I feel like I'm just going through the motions, going from one hobby to another without truly connecting to any of them.""}
 {'from': 'gpt', 'value': ""It sounds like you're searching for that spark again, something that can reignite your passion and enthusiasm. Let's take a moment to reflect on what you enjoy doing. What are some activities that used to bring you happiness before he came into your life?""}
 {'from': 'human', 'value': ""Well, I used to love painting. It was my way of expressing myself and finding solace. But lately, even picking up a paintbrush feels like a mundane task. It doesn't give me the same sense of fulfillment anymore.""}
 {'from': 'gpt', 'value': ""I hear you, Charlie. Sometimes, when we're faced with loss or significant change, it can be challenging to find that same level of engagement in activities we used to enjoy. Have you considered trying different art forms or exploring other creative outlets?""}
 {'from': 'human', 'value': ""Not really, to be honest. I guess I've been so fixated on trying to find something that reminds me of him, I haven't really allowed myself to explore other options. But maybe it's time I step out of my comfort zone and try something new.""}
 {'from': 'gpt', 'value': ""That's a great perspective, Charlie. Exploring new avenues and allowing yourself to be open to different experiences can often lead to unexpected discoveries. Is there something specific that has caught your attention recently?""}
 {'from': 'human', 'value': ""I've always enjoyed nature, so maybe I could try gardening. Connecting with the earth and watching something grow might bring some sense of purpose back into my life.""}
 {'from': 'gpt', 'value': 'That sounds like a wonderful idea, Charlie. Gardening can be incredibly therapeutic and rewarding. It allows you to nurture and witness the growth and beauty of living things. How do you feel about giving it a try?'}
 {'from': 'human', 'value': ""I'm willing to give it a shot. Maybe tending to plants will help me feel connected to something again, even if it's not a person. I just hope it's enough to fill this void within me.""}
 {'from': 'gpt', 'value': ""It's important to remember that hobbies aren't meant to completely replace the relationships we've lost, but rather provide us with a sense of purpose and joy. Cultivating your newfound interest in gardening may not fill the void entirely, but it can certainly start to bring some light back into your life. Would you like to explore some resources to help you get started?""}
 {'from': 'human', 'value': ""Yes, please. I'm willing to put in the effort and see where this journey takes me. Thank you, Alex, for guiding me through this reflection. I'm slowly realizing that maybe there are still things out there that can bring me happiness, even if it's different from what I've known before.""}
 {'from': 'gpt', 'value': ""You're very welcome, Charlie. Remember, healing takes time and patience. I'm here to support you as you embark on this new chapter. Let's work together to guide you towards finding fulfillment and rediscovering joy in your life.""}]",identity_93761
"[{'from': 'human', 'value': ""Hey Alex, I hope you're doing okay. I've been feeling really sad lately, especially when it comes to personal relationships. It's like a heavy weight on my chest, and I'm struggling to find a way out of this emotional slump. I guess I'm just tired of feeling responsible for all the love and care in my relationships.""}
 {'from': 'gpt', 'value': ""Hi Charlie, I'm here for you. It sounds like you're carrying a lot on your shoulders right now. Can you tell me more about why you feel responsible for all the love and care in your relationships?""}
 {'from': 'human', 'value': ""Yeah, it's like I always feel this pressure to be the person who keeps everything together. I'm expected to be the one who is always loving and responsible, making sure everyone else is happy. But it's exhausting, Alex. I feel like I'm neglecting my own needs.""}
 {'from': 'gpt', 'value': ""That's a heavy burden to bear, Charlie. It's important to remember that in healthy relationships, love and responsibility should be shared. Have you communicated your feelings to the people you're closest to? Letting them know how you're struggling might help lighten the weight.""}
 {'from': 'human', 'value': ""You're right, Alex. Communication is key. But sometimes I worry that if I express my needs, I'll be seen as selfish or needy. I guess I put others' happiness before my own, hoping that someday they'll reciprocate.""}
 {'from': 'gpt', 'value': ""It's understandable to have those worries, Charlie. It's crucial to take care of your own emotional well-being. Putting yourself first doesn't make you selfish; it's an act of self-love and preservation. Have you considered setting boundaries in your relationships to ensure your needs are met too?""}
 {'from': 'human', 'value': ""Boundaries... that's something I struggle with. I'm afraid of disappointing or hurting others, so I often let them cross my boundaries. But maybe it's time to change that, to not always be the one who sacrifices their own happiness.""}
 {'from': 'gpt', 'value': ""Absolutely, Charlie. Boundaries are fundamental for maintaining healthy relationships. They allow you to communicate your limits and needs without guilt or fear. Remember, it's okay to say no and prioritize your own well-being. How do you feel about taking some small steps towards establishing those boundaries?""}
 {'from': 'human', 'value': ""I feel scared, Alex. Scared of potential conflict or rejection. But I know deep down that it's necessary for my own growth and happiness. It's time for me to start being more assertive and setting boundaries, even if it means facing some discomfort.""}
 {'from': 'gpt', 'value': 'Fear is a natural response, Charlie, but growth often comes from stepping out of our comfort zones. I believe in your ability to find the balance between love and responsibility. Have you thought about seeking support from a close friend or a therapist during this process?'}
 {'from': 'human', 'value': ""I haven't really considered it, Alex, but it sounds like a great idea. Having someone who can provide guidance and encouragement could make a world of difference. I'm glad I reached out to you today. Your words bring me some comfort in this difficult time.""}
 {'from': 'gpt', 'value': ""I'm glad I could provide some comfort, Charlie. Remember, therapy can be a safe space where you can explore your emotions and receive the support you need. I'm here for you, and you don't have to face this journey alone. Is there anything else on your mind that you'd like to discuss?""}]",identity_13826
"[{'from': 'human', 'value': ""Hey Alex, I hope you're doing okay. I just needed someone to talk to right now. I'm feeling really disappointed and I've made a big decision in my life.""}
 {'from': 'gpt', 'value': ""Hi Charlie, I'm here for you. I'm sorry to hear that you're feeling disappointed. It sounds like you're going through a tough time. Can you tell me more about the decision you've made?""}
 {'from': 'human', 'value': ""Yeah, sure. Well, I recently ended a long-term relationship and it's been really hard for me. I thought we were going to be together forever, but things just didn't work out. I made the decision to let go, but it's left me feeling empty and lost.""}
 {'from': 'gpt', 'value': ""I can only imagine how challenging this is for you, Charlie. It takes a lot of strength to make such a difficult decision. It's completely normal to feel disappointed after a breakup, especially when you had envisioned a future together. How are you coping with these feelings of emptiness and loss?""}
 {'from': 'human', 'value': ""Honestly, it's been tough. Some days I feel like I'm just going through the motions, trying to distract myself from the pain. But other times, it hits me like a wave and I find myself drowning in sadness. I've been crying a lot and it feels like my heart is just shattered into a million pieces.""}
 {'from': 'gpt', 'value': ""I can sense the intensity of your emotions, Charlie. Heartbreak can be incredibly overwhelming, and it's important to allow yourself to feel whatever comes up. Grieving the loss of a relationship is a natural part of the healing process. Have you been able to find any healthy outlets for your emotions, such as talking to friends or engaging in activities that bring you joy?""}
 {'from': 'human', 'value': ""Yeah, I've been leaning on my friends a lot. They've been so supportive and understanding, which I'm really grateful for. They've been there to listen to me vent and offer advice, but it's still hard to shake off this sadness. I used to love painting, but even that doesn't bring me the same joy it used to.""}
 {'from': 'gpt', 'value': ""It's wonderful that you have a supportive circle of friends, Charlie. They can provide a valuable source of comfort during this difficult time. It's understandable that even activities you used to enjoy may not feel the same right now. Healing takes time, and sometimes our interests and passions shift as we go through heartbreak. I'm curious, what are some things you're doing to take care of yourself during this process?""}
 {'from': 'human', 'value': ""Well, I've been trying to focus on self-care. I make sure to take long walks in nature, as it helps clear my mind, even if just for a little while. I've also started writing in a journal to release some of the emotions that are overwhelming me. And I've been reminding myself to be gentle with myself, giving myself permission to feel sad without judgment.""}
 {'from': 'gpt', 'value': ""Those are wonderful self-care practices, Charlie. Nature can indeed offer solace and provide a sense of grounding. Writing in a journal can be a powerful way to process your emotions and gain clarity. It's fantastic that you're being compassionate with yourself and allowing space for your sadness. Have you noticed any shifts in your emotions or thought patterns as you continue with these practices?""}
 {'from': 'human', 'value': ""I think I've had some glimpses of hope, moments where I can see a potential future where I am happy again. But then, the sadness creeps back in, and it feels like I'm back to square one. It's a rollercoaster of emotions, and sometimes it's hard to believe that I'll ever truly move on from this heartbreak.""}
 {'from': 'gpt', 'value': ""It's completely normal to experience those ups and downs, Charlie. Healing is not a linear process, and it's common to have moments of hope followed by setbacks. Remember, healing takes time, and it's okay to take things one day at a time. What are some things that bring you hope, even if it's just for a fleeting moment?""}
 {'from': 'human', 'value': ""I find solace in music. Certain songs have a way of touching my heart and reminding me that I'm not alone in my pain. They make me feel understood in a way that words can't fully express. And sometimes, when I see others who have healed from heartbreak, it gives me hope that I can too.""}
 {'from': 'gpt', 'value': ""Music is a powerful medium, Charlie. It has a unique ability to speak to our souls and provide comfort during difficult times. It's beautiful that you can find solace in the artistry of others. And seeing others who have healed can indeed serve as a reminder that it's possible for you too. As we wrap up today's session, I encourage you to continue exploring these sources of hope and practicing self-care. Remember, healing is a personal journey, and you're not alone in this process. Is there anything else you'd like to share before we end?""}
 {'from': 'human', 'value': ""Thank you so much, Alex. I appreciate your support and guidance. It feels good to have someone who understands and listens without judgment. I'm going to keep working on healing and finding my way through this heartbreak. I know it won't be easy, but I believe there's light at the end of the tunnel.""}
 {'from': 'gpt', 'value': ""You're most welcome, Charlie. It's an honor to be part of your healing journey. Remember, it's okay to feel sad and to take the time you need to heal. The light at the end of the tunnel may seem distant now, but it will become brighter with each step you take. I'm here for you whenever you need to talk. Take care of yourself, and until next time.""}]",identity_29305
"[{'from': 'human', 'value': 'I am relieved that I finally ended my toxic relationship. The breakup was tough, but I know it was the right decision for me.'}
 {'from': 'gpt', 'value': ""Hi Charlie, I'm glad to hear that you're feeling relieved after the breakup. It takes a lot of strength to end a toxic relationship and prioritize your own well-being. How are you coping with the emotions that come with this heartbreak?""}
 {'from': 'human', 'value': ""Thanks, Alex. It's been an emotional rollercoaster, but I'm determined to stay positive and grow from this experience. I've been focusing on self-reflection and understanding what went wrong in the relationship. It's important for me to learn and grow from it.""}
 {'from': 'gpt', 'value': ""That's a great attitude to have, Charlie. Self-reflection is key to healing and moving forward. What kind of insights or realizations have you had so far about what went wrong in the relationship?""}
 {'from': 'human', 'value': ""I've realized that I neglected my own needs and compromised my values just to keep the relationship going. I lost sight of my own happiness and became overly dependent on my partner for validation. It wasn't healthy, and it took a toll on both of us.""}
 {'from': 'gpt', 'value': ""It's commendable that you're able to recognize these patterns, Charlie. It's important to remember that relationships should be a balance of give and take, where both partners thrive individually and together. How do you plan to prioritize your own needs moving forward?""}
 {'from': 'human', 'value': ""Moving forward, I'm committed to practicing self-care and setting healthy boundaries. I'll pay closer attention to my own needs and make sure not to compromise my values again. I deserve to be with someone who appreciates and supports me.""}
 {'from': 'gpt', 'value': 'Absolutely, Charlie. Prioritizing self-care and setting boundaries are crucial steps in building healthier relationships. What are some ways you plan to integrate self-care into your daily routine?'}
 {'from': 'human', 'value': ""I plan to make time for activities that bring me joy and help me reconnect with myself. This could be taking walks in nature, journaling, listening to uplifting music, or surrounding myself with positive and supportive friends. It's all about nurturing my own well-being.""}
 {'from': 'gpt', 'value': ""That sounds wonderful, Charlie. Remember, self-care isn't selfish; it's necessary for personal growth and happiness. It's inspiring to see your determination to flourish even after experiencing heartbreak. How do you envision your ideal future, with self-love and healthier relationships?""}
 {'from': 'human', 'value': ""In my ideal future, I envision myself being content and at peace, surrounded by loved ones who uplift and support me. I see myself valuing my own worth and attracting people who align with my values. I'm hopeful for a future filled with healthy and fulfilling relationships.""}
 {'from': 'gpt', 'value': ""That's a beautiful vision, Charlie. Your determination and positive mindset will undoubtedly lead you towards a future filled with love and happiness. Remember, healing takes time, so be patient with yourself throughout this journey. Is there anything else you would like to reflect on or discuss today?""}
 {'from': 'human', 'value': ""Thank you, Alex. I appreciate your guidance and support. I think we've covered a lot today, and I feel more motivated than ever to create a brighter future for myself. Knowing that I have the power to break free from toxic relationships has given me a newfound sense of strength.""}
 {'from': 'gpt', 'value': ""You're very welcome, Charlie. It's been a pleasure working with you, and I'm glad I could be here to support you. Remember, I'm always here if you need to continue these conversations or explore any other topics. Stay motivated and take care of yourself, always.""}]",identity_68450
"[{'from': 'human', 'value': ""I'm so scared, Alex. I just can't seem to shake this feeling of rejection.""}
 {'from': 'gpt', 'value': ""Hey Charlie, I'm here for you. Can you tell me what happened that made you feel this way?""}
 {'from': 'human', 'value': ""She ended our relationship out of nowhere. I didn't see it coming, and it's left me feeling lost and unwanted.""}
 {'from': 'gpt', 'value': ""That sounds tough, Charlie. It must be really hard to go through something like that. Can you tell me more about how you're feeling right now?""}
 {'from': 'human', 'value': 'I feel empty, like a part of me is missing. I keep replaying our memories and wondering what I did wrong.'}
 {'from': 'gpt', 'value': ""It's understandable to feel that way after a heartbreak. Remember, it's not always about you. Sometimes things just don't work out, and that doesn't mean you're not worthy of love.""}
 {'from': 'human', 'value': ""It's just so hard not to take it personally. I keep questioning my worth and wondering if I'll ever find someone who truly wants me.""}
 {'from': 'gpt', 'value': ""Charlie, rejection can shake our confidence, but it's important to remember that there is someone out there who will value and appreciate you for who you are. What are some things you enjoy doing that can help take your mind off the pain?""}
 {'from': 'human', 'value': 'I used to love hiking and painting. Maybe I should try picking those hobbies back up.'}
 {'from': 'gpt', 'value': 'That sounds like a great idea! Engaging in activities you enjoy can be a positive outlet for your emotions. It can also help you rediscover yourself and build your self-esteem.'}
 {'from': 'human', 'value': ""I'm just afraid that I won't find happiness again. It feels like my heart will never heal.""}
 {'from': 'gpt', 'value': ""I understand that it may feel that way right now, but healing takes time. In the meantime, focus on self-care and surround yourself with supportive friends and family. Have you spoken to anyone about what you're going through?""}
 {'from': 'human', 'value': ""I've opened up to a few close friends, but it's hard for me to fully express how I'm feeling.""}
 {'from': 'gpt', 'value': ""Sometimes it can be challenging to articulate our emotions. Just know that your friends care about you and want to support you. It's okay to lean on them during this difficult time.""}
 {'from': 'human', 'value': 'Thank you, Alex. I appreciate your gentle guidance and kind words. It feels good to have someone to talk to.'}
 {'from': 'gpt', 'value': ""You're most welcome, Charlie. Remember, healing is a process, and you're taking the first steps towards finding happiness again. Is there anything else you'd like to discuss or any questions you have?""}
 {'from': 'human', 'value': ""Not right now, Alex. I'll try to take your advice and focus on myself. Thank you for being there for me.""}
 {'from': 'gpt', 'value': ""You're doing great, Charlie. Don't hesitate to reach out if you ever need someone to talk to. Take care of yourself, and remember, you deserve happiness.""}]",identity_10142
"[{'from': 'human', 'value': ""I feel so ashamed. I can't believe I cheated on my partner.""}
 {'from': 'gpt', 'value': 'Charlie, I can imagine it must be really difficult for you to admit to cheating. Can you tell me a bit more about what led you to this point?'}
 {'from': 'human', 'value': ""I've been feeling lost and disconnected from my partner for a while. It's like we've grown apart, and I didn't know how to fix it. I made a terrible mistake and it's eating me up inside.""}
 {'from': 'gpt', 'value': ""It sounds like there may have been deeper issues in your relationship that contributed to this. Have you spoken with your partner about how you've been feeling?""}
 {'from': 'human', 'value': ""Not yet, but I want to. I want to apologize and try to repair our relationship. I know I can't change what I've done, but I can work towards bettering myself.""}
 {'from': 'gpt', 'value': ""That's a brave step, Charlie. Acknowledging your mistake and taking responsibility is the first step towards healing. Are you willing to explore why you felt disconnected in your relationship?""}
 {'from': 'human', 'value': 'Yes, definitely. I think a lot of it has to do with our busy lives. We stopped communicating and making time for each other. We got caught up in the daily grind and forgot to nurture our relationship.'}
 {'from': 'gpt', 'value': ""It's common for relationships to go through ups and downs, but it's important to remember that it's not the end. What are some things you could do to reconnect with your partner?""}
 {'from': 'human', 'value': 'I could start by sitting down with them and having an open and honest conversation. We can express our feelings and concerns, and actively listen to each other. Maybe even plan some quality time together.'}
 {'from': 'gpt', 'value': ""Excellent approach, Charlie. Communication and quality time are key ingredients to rebuilding a connection. How might you address the guilt and shame you're feeling right now?""}
 {'from': 'human', 'value': 'I think opening up to my partner about my remorse will help. Additionally, I might consider seeking therapy to understand myself better and learn healthier ways to cope with my emotions.'}
 {'from': 'gpt', 'value': ""That's an important step towards your own personal growth. It's essential to address your own emotional well-being while working on your relationship. And remember, forgiveness, both from your partner and yourself, takes time.""}
 {'from': 'human', 'value': ""Thank you, Alex. I truly appreciate your support and guidance. It's reassuring to know that there's hope for redemption and rebuilding trust.""}
 {'from': 'gpt', 'value': ""You're welcome, Charlie. Remember, everyone makes mistakes, but it's what we do next that defines us. I believe in your willingness to grow and heal. Is there anything else you'd like to discuss or any other questions you have?""}
 {'from': 'human', 'value': 'No, I think this has been incredibly helpful. It feels good to have a plan of action and some guidance on how to move forward. Thank you, Alex, for being here for me.'}
 {'from': 'gpt', 'value': ""It's my privilege to assist you in this journey, Charlie. I'm here whenever you need, so don't hesitate to reach out. Remember, you are capable of growth and change. Take care, and be gentle with yourself.""}]",identity_98756
