conversations,id
"[{'from': 'human', 'value': ""I'm feeling really regretful lately, Alex. She, my best friend, has been there for me through thick and thin, and I don't think I've been as supportive as I should be.""}
 {'from': 'gpt', 'value': ""It takes courage to acknowledge our shortcomings, Charlie. What makes you think you haven't been supportive enough to your friend?""}
 {'from': 'human', 'value': ""Well, Alex, she's been going through a tough time herself, and I've been so consumed by my own problems that I haven't taken the time to truly listen and be there for her.""}
 {'from': 'gpt', 'value': ""It sounds like you recognize the importance of being present for your friend. Can you tell me more about the challenges you've been facing that have made it difficult for you to be supportive?""}
 {'from': 'human', 'value': ""I've been dealing with a deep sense of emptiness and sadness, Alex. It's like a dark cloud hovering over me, draining all my energy and making it hard to focus on anything besides my own thoughts.""}
 {'from': 'gpt', 'value': 'Depression can be overwhelming and make it challenging to extend support to others. How has your own experience with depression affected your ability to be there for your friend?'}
 {'from': 'human', 'value': ""It has made me withdraw, Alex. I've isolated myself, thinking that my own struggles are too burdensome for anyone to handle. But now I realize that it's not fair to neglect her when she needs someone to talk to.""}
 {'from': 'gpt', 'value': 'Recognizing the impact of your depression on your relationships is a significant step, Charlie. What are some ways you think you can start rebuilding that connection with your friend?'}
 {'from': 'human', 'value': ""I want to make a conscious effort to actively listen and engage with her, Alex. Putting my own regrets aside, I want to be a source of support and encouragement, just like she's been for me.""}
 {'from': 'gpt', 'value': ""That's a wonderful intention, Charlie. How do you imagine she might react when she sees your effort to be more present?""}
 {'from': 'human', 'value': ""I hope she feels loved and valued, Alex. I want her to know that even though I've been struggling, I see her and appreciate her presence in my life.""}
 {'from': 'gpt', 'value': 'Expressing your gratitude and appreciation can have a profoundly positive impact on your friendship. Have you considered speaking with her about your personal battles with depression?'}
 {'from': 'human', 'value': ""I haven't, Alex. I've been hesitant to burden her with my problems, but maybe opening up about my struggles could bring us closer and foster a deeper understanding between us.""}
 {'from': 'gpt', 'value': ""It's essential to remember that true friendships are built on honesty and vulnerability, Charlie. Sharing your experiences can create a safe space for both of you to support each other. How do you feel about taking this step?""}
 {'from': 'human', 'value': ""It feels scary, yet empowering, Alex. I believe it's time to let go of the fear of judgment and embrace the strength that vulnerability brings. It's time to deepen our bond and grow together.""}
 {'from': 'gpt', 'value': 'I admire your bravery, Charlie. Remember, opening up about your depression not only allows you to lean on your friend for support but also creates an opportunity for her to understand your journey on a much deeper level.'}
 {'from': 'human', 'value': 'Thank you for your encouragement, Alex. I feel inspired to have an open and honest conversation with her, one where we can both feel seen and heard.'}
 {'from': 'gpt', 'value': ""You're very welcome, Charlie. Remember, the healing process is a journey, and by taking this step, you're already on your way towards finding the support and connection you deserve.""}
 {'from': 'human', 'value': ""I'm grateful for your guidance, Alex. I'm ready to face my regrets and deepen my friendship, knowing that I have your support and a newfound determination within me.""}
 {'from': 'gpt', 'value': ""I'm here for you every step of the way, Charlie. Together, we'll work on cultivating self-compassion and building stronger connections that will bring joy and fulfillment into your life.""}]",identity_2611
"[{'from': 'human', 'value': ""Hi Alex, I've been feeling really worried lately, and I know that something needs to change in my life.""}
 {'from': 'gpt', 'value': 'Hello Charlie, I appreciate you reaching out. It takes a lot of courage to acknowledge your worries and the need for change. What specifically has been weighing on your mind?'}
 {'from': 'human', 'value': ""I've been struggling with addiction for quite some time now, and it has taken a toll on my relationships, career, and overall well-being. I know deep down that I need to break free from this cycle and make a positive change.""}
 {'from': 'gpt', 'value': ""Your willingness to confront your addiction and desire for change is incredibly inspiring, Charlie. Addiction is a tough battle, but I believe in your strength and your ability to overcome it. Let's focus on finding ways to support your journey towards a healthier and happier life. What steps have you considered taking to initiate this change?""}
 {'from': 'human', 'value': ""Thank you, Alex. I'm determined to make the necessary changes. I've been doing some research and gathering information about various treatment options available in my area. I think exploring therapy, support groups, and possible inpatient programs could be beneficial for me. It's important to surround myself with like-minded individuals who understand what I'm going through.""}
 {'from': 'gpt', 'value': 'That sounds like a very proactive and positive approach, Charlie. Seeking professional help, such as therapy or support groups, can provide you with valuable guidance, encouragement, and a sense of solidarity. Building a support network is crucial in overcoming addiction. Are there any specific resources you have in mind or any questions you would like to discuss further?'}
 {'from': 'human', 'value': ""I've found a local addiction counseling center that offers individual and group therapy sessions. They also have connections with rehabilitation centers that specialize in addiction recovery. I'm interested in exploring both options and discussing them further with you.""}
 {'from': 'gpt', 'value': ""It's wonderful that you've already identified potential resources, Charlie. Let's delve deeper into these options together. In individual therapy, you'll have the opportunity to work one-on-one with a counselor who can help you develop coping strategies, explore the underlying causes of your addiction, and establish realistic goals for your recovery. Group therapy, on the other hand, can provide a supportive and empathetic environment where you can share your experiences and learn from others who are on a similar path. How do these options resonate with you?""}
 {'from': 'human', 'value': ""Both individual and group therapy sound beneficial to me, Alex. I believe that the combination of personal introspection and shared experiences could create a well-rounded recovery journey. I want to maximize my chances of success and make the most out of this opportunity. Knowing that I'm not alone in this struggle is empowering.""}
 {'from': 'gpt', 'value': ""Your determination and willingness to embrace multiple avenues of support are commendable, Charlie. Remember, recovery is not a linear process, and it's essential to be gentle with yourself along the way. Celebrate every small victory and acknowledge the progress you make, no matter how seemingly insignificant. How do you envision incorporating these therapies into your life, alongside your existing commitments?""}
 {'from': 'human', 'value': 'I understand the importance of maintaining balance, Alex. I plan to dedicate specific days and times each week for therapy sessions, ensuring that I can prioritize my recovery without neglecting my other responsibilities. By establishing a routine, I believe I can create a stable foundation for my journey towards change and freedom from addiction.'}
 {'from': 'gpt', 'value': ""That level of commitment and planning demonstrates your readiness for change, Charlie. Implementing a structured routine will provide you with stability and a sense of purpose. Remember, you have the power to shape your future and create a life that aligns with your true values. Is there anything else you'd like to discuss or any additional concerns you have regarding this transformative process?""}
 {'from': 'human', 'value': 'Thank you, Alex. I truly appreciate your guidance and support. One concern I have is managing potential triggers or setbacks along the way. I want to be prepared for any challenges that come my way so that I can stay on track with my recovery.'}
 {'from': 'gpt', 'value': ""Acknowledging the possibility of triggers and setbacks is an important step, Charlie. It's crucial to develop a relapse prevention plan tailored to your needs. I recommend focusing on identifying potential triggers, implementing healthy coping mechanisms, and surrounding yourself with a strong support system that can aid you during challenging times. Remember, setbacks do not define your journey; it's how you respond and learn from them that truly matters.""}
 {'from': 'human', 'value': ""I understand, Alex. I will be diligent in creating a solid relapse prevention plan and lean on my support system during tough moments. I'm grateful for this opportunity to explore the path of recovery and am excited about the positive changes that lie ahead.""}
 {'from': 'gpt', 'value': 'Your motivation and commitment to your recovery journey are inspiring, Charlie. I have complete faith in your ability to break free from the grips of addiction and create a fulfilling and joyful life. As your therapist, I will be here to provide ongoing support, address any concerns, and celebrate your achievements. Together, we will navigate this transformative process, one step at a time.'}]",identity_46512
"[{'from': 'human', 'value': ""Hey Alex, I hope you're doing well. I wanted to talk to you about something that has been bothering me lately. I've been feeling really insecure about my friendships.""}
 {'from': 'gpt', 'value': ""Hi Charlie, I'm here for you. I'm sorry to hear that you've been feeling insecure about your friendships. Can you tell me more about what's been going on?""}
 {'from': 'human', 'value': ""Yeah, sure. Lately, I've been questioning if my friends really like me or if they're just pretending. It's been making me feel sad and lonely. I don't know why I can't shake this feeling.""}
 {'from': 'gpt', 'value': ""It sounds like you're going through a difficult time, Charlie. Sometimes, we all experience doubts and insecurities in our relationships. Can you think of any specific situations or reasons why you might be feeling this way?""}
 {'from': 'human', 'value': ""Well, there have been instances where I've invited my friends to do things, but they always seem to have other plans. It makes me wonder if they're avoiding me or if I'm just not important enough to them.""}
 {'from': 'gpt', 'value': ""It's understandable that these situations may leave you feeling uncertain about your friendships. Have you tried expressing your concerns to your friends?""}
 {'from': 'human', 'value': ""No, I haven't. I guess I'm scared that if I talk to them about how I'm feeling, they might confirm my fears and say that they don't really care about me.""}
 {'from': 'gpt', 'value': ""It's natural to feel afraid of rejection, Charlie, but opening up to your friends about your insecurities can lead to a deeper understanding and stronger friendships. It may help to express your feelings in a gentle and non-confrontational way, letting them know that you value their friendship and would appreciate their reassurance.""}
 {'from': 'human', 'value': ""I never thought about it that way. Maybe I should give it a try. It's just hard to put myself out there and risk getting hurt.""}
 {'from': 'gpt', 'value': 'I understand that it can be daunting, Charlie. It takes courage to be vulnerable, but it can also be a rewarding experience. Remember, true friends will appreciate your honesty and will be there to support you. How do you think you could approach the conversation with your friends?'}
 {'from': 'human', 'value': ""I think I could start by choosing a comfortable and private setting where we can all talk openly. I will let them know that I've been feeling a bit insecure and would appreciate their input. By creating a safe space for open communication, I hope they'll understand where I'm coming from.""}
 {'from': 'gpt', 'value': ""That sounds like a thoughtful plan, Charlie. Creating a safe space for open dialogue is important in strengthening relationships. As you have this conversation, it's essential to remember that your feelings are valid, and you deserve to feel secure and valued in your friendships. What do you think would be the best outcome of this conversation for you?""}
 {'from': 'human', 'value': 'I hope that my friends will listen and understand me. It would be great if they could offer reassurance and validate my feelings. Knowing that they genuinely care about me will help alleviate my insecurities and bring a sense of peace to my heart.'}
 {'from': 'gpt', 'value': ""It's understandable that you're seeking reassurance and validation, Charlie. Remember that you also deserve to be surrounded by friends who uplift and support you. It's important to maintain healthy boundaries and prioritize relationships that bring positivity into your life. How can you take care of yourself throughout this process?""}
 {'from': 'human', 'value': ""I think I need to practice self-compassion and remind myself that my worth is not defined by others' opinions of me. Taking care of my mental and emotional well-being is crucial. Engaging in activities that bring me joy and exploring new hobbies might also help boost my confidence and nurture new friendships.""}
 {'from': 'gpt', 'value': ""That's a wonderful approach, Charlie. Prioritizing self-care and engaging in new hobbies can be beneficial in building confidence and expanding your social circle. Is there a specific hobby that interests you?""}
 {'from': 'human', 'value': ""Well, I've always been curious about painting. I think it might be a great way to channel my emotions and find a sense of peace. Plus, it's something I can do alone or even try to connect with others who share the same passion.""}
 {'from': 'gpt', 'value': ""Painting can indeed be a therapeutic way to express yourself, Charlie. Exploring this new hobby can provide you with a creative outlet and a chance to connect with others who share your interest. It's wonderful to see you finding ways to nurture your own well-being. How do you plan on getting started with painting?""}
 {'from': 'human', 'value': ""I'll start by searching for local art classes or workshops. Being in a supportive environment with like-minded individuals can help me learn the basics and gain confidence in my artistic abilities. I'm excited to embark on this new journey and see where it takes me.""}
 {'from': 'gpt', 'value': ""That sounds like a fantastic plan, Charlie. Embracing this new hobby can not only provide you with an outlet for self-expression but also potentially introduce you to new friendships and a sense of community. Remember to be patient and kind to yourself as you explore and develop your painting skills. Is there anything else you'd like to discuss or any other concerns you have?""}
 {'from': 'human', 'value': ""For now, I feel like we've covered the main topics that were bothering me. I appreciate your guidance, Alex. It's been quite helpful to talk things through with you. I'll keep you updated on how my painting journey progresses.""}
 {'from': 'gpt', 'value': ""I'm glad I could be here to provide you support, Charlie. Remember that therapy is a space for you to explore and grow. I'm always here to listen and offer guidance whenever you need it. Take care of yourself, and I hope your painting journey brings you joy and fulfillment. Keep in touch, and feel free to reach out whenever you need.""}]",identity_93502
"[{'from': 'human', 'value': ""Hi Alex! I hope you're doing well today. I've been feeling really hopeful lately, but I'm also feeling a lot of pressure when it comes to my personal relationships. Can you help me navigate through this?""}
 {'from': 'gpt', 'value': ""Hello Charlie! I'm glad to hear that you're feeling hopeful. It's wonderful to have that positive outlook. Let's explore the pressure you're experiencing in your personal relationships. Can you tell me a bit more about what's been going on?""}
 {'from': 'human', 'value': ""Well, Alex, I've been putting a lot of pressure on myself to maintain the perfect relationships with my friends and family. I want to be there for everyone, always making sure they're happy. But lately, it's been overwhelming. I feel like I'm juggling too many expectations and it's taking a toll on my own well-being.""}
 {'from': 'gpt', 'value': ""I see, Charlie. It sounds like you're carrying a heavy load by trying to please everyone around you. It's important to prioritize your own well-being too. Let's explore some ways to manage this pressure. Have you considered setting boundaries in your relationships?""}
 {'from': 'human', 'value': ""Yes, I have thought about it, but I'm afraid that setting boundaries might make me seem selfish or detached. I don't want to disappoint my loved ones, but I also need to take care of myself.""}
 {'from': 'gpt', 'value': ""I understand your concern, Charlie. Setting boundaries doesn't mean you're being selfish; it means you're taking care of your own needs so that you can be there for others in a healthier way. How about we explore some strategies to communicate your boundaries effectively? It's important to remember that your loved ones should respect your needs too.""}
 {'from': 'human', 'value': ""That makes sense, Alex. I guess I haven't really considered that my loved ones might understand and respect my boundaries. Are there any specific strategies you can suggest for communicating boundaries effectively?""}
 {'from': 'gpt', 'value': ""Absolutely, Charlie. One strategy is to have open and honest conversations with your loved ones, explaining how you're feeling and why setting boundaries is important for your well-being. Another approach is to start small by setting boundaries in certain areas of your life and gradually expanding them as you become more comfortable. Remember, practicing self-care is not selfish; it's essential for maintaining healthy relationships.""}
 {'from': 'human', 'value': ""Those strategies sound doable, Alex. I'll give it a try and see how it goes. It's reassuring to know that setting boundaries doesn't mean I'm pushing people away but rather taking care of my own happiness. Thank you for your guidance.""}
 {'from': 'gpt', 'value': ""You're welcome, Charlie. It's great to hear that you're willing to give these strategies a try. Remember, personal growth takes time, so be patient with yourself. Is there anything else you'd like to discuss regarding your personal relationships?""}
 {'from': 'human', 'value': 'Well, there is one thing, Alex. I often find myself comparing my relationships to others, and it sometimes makes me feel insecure. How can I overcome this habit and stop comparing?'}
 {'from': 'gpt', 'value': ""Comparing our relationships to others can be challenging, Charlie. It's essential to remember that each person's journey is unique, and what works for others may not align with your own experiences and values. Instead of comparing, focus on appreciating the special qualities and connections within your own relationships. Practicing gratitude can help shift your perspective and cultivate contentment within.""}
 {'from': 'human', 'value': ""That's an excellent suggestion, Alex. I'll make an effort to practice gratitude and remind myself of the unique aspects of my relationships. I believe this will help me appreciate what I have rather than comparing it to others. Thank you so much for your guidance and understanding.""}
 {'from': 'gpt', 'value': ""You're most welcome, Charlie. I'm here to support you on this journey of self-discovery and growth. Remember, you have the power to shape your personal relationships in a way that aligns with your values and brings you happiness. Is there anything else you'd like to explore today?""}
 {'from': 'human', 'value': ""I think we've covered a lot, Alex. Your guidance has truly been invaluable, and I feel much more equipped to navigate my personal relationships now. I'll continue working on setting boundaries and practicing gratitude. Thank you for your empathy and support!""}
 {'from': 'gpt', 'value': ""It's been a pleasure working with you, Charlie. I'm glad I could be of help. Remember, therapy is an ongoing process, and if you ever need support along the way, don't hesitate to reach out. Take care of yourself and cherish those personal relationships. Have a wonderful day!""}]",identity_4483
