conversations,id
"[{'from': 'human', 'value': ""I'm feeling really sad lately, Alex. I've been trying to find a new hobby to lift my spirits, but I'm not very confident in myself.""}
 {'from': 'gpt', 'value': ""I can understand how difficult that might be for you, Charlie. It takes some courage to try something new, especially when you're feeling down. What kind of hobbies are you interested in?""}
 {'from': 'human', 'value': ""Well, I used to enjoy playing the guitar when I was younger. But I haven't picked it up in years. I'm not sure if I still have the same passion for it.""}
 {'from': 'gpt', 'value': 'It sounds like playing the guitar used to bring you joy. Have you tried playing it recently, just to see if it sparks any interest?'}
 {'from': 'human', 'value': ""No, I haven't. Maybe I should give it a try, but I worry that I won't be as good as I used to be. It's disheartening to think about.""}
 {'from': 'gpt', 'value': ""It's understandable to feel that way, Charlie. Remember, the process of rediscovering a hobby is about finding enjoyment, not about perfection. Letting go of expectations can be liberating. How do you feel when you imagine yourself playing the guitar again?""}
 {'from': 'human', 'value': ""I guess there's a part of me that feels a glimmer of excitement. Like maybe it could bring some joy back into my life. But there's also fear. Fear that I won't be able to play like I used to, and that disappointment will overshadow any positive feelings.""}
 {'from': 'gpt', 'value': ""It's natural to have those fears, Charlie. They often accompany new beginnings. But what's important is to focus on the process rather than the end result. Would you be willing to set aside time regularly to explore playing the guitar again, just for yourself?""}
 {'from': 'human', 'value': ""I think I could give it a try. Maybe I could commit to practicing for just 10 minutes a day to begin with. That way, I won't feel overwhelmed or pressured.""}
 {'from': 'gpt', 'value': ""That's a great approach, Charlie. Starting with small, manageable steps is an excellent way to build confidence. And remember, the goal isn't just to become a skilled guitarist, but to find a sense of fulfillment and peace in the process. What other hobbies have you considered?""}
 {'from': 'human', 'value': ""I've also thought about painting. It seems like a calming activity, and I've always admired art. But I feel hesitant because I've never painted before and worry that I won't be any good at it.""}
 {'from': 'gpt', 'value': ""Trying something new can definitely make you feel uncertain, but that's where growth begins. Have you considered taking a beginner's painting class or watching online tutorials to get started?""}
 {'from': 'human', 'value': ""I hadn't thought of that, but it's a good idea. I could learn some basic techniques and see if it's something I enjoy. It could be a way to express my emotions in a different way.""}
 {'from': 'gpt', 'value': 'Absolutely, Charlie. Art can be a form of self-expression and a way to process emotions. Taking that step towards exploring painting could lead to new insights about yourself. How does the idea of creating art make you feel?'}
 {'from': 'human', 'value': ""It feels slightly intimidating but also intriguing. I like the idea of being able to express myself visually. Maybe it's worth giving it a shot and seeing where it takes me.""}
 {'from': 'gpt', 'value': ""That's the spirit, Charlie. Remember, this journey is about exploring different hobbies to find what resonates with you. It's okay to feel unsure or even sad along the way. Is there anything else you'd like to discuss regarding your new hobby search?""}
 {'from': 'human', 'value': 'Not right now, Alex. But I appreciate your guidance and support. It feels good to have someone who understands my struggle and is willing to help me navigate this challenging path.'}
 {'from': 'gpt', 'value': ""I'm here for you, Charlie, every step of the way. Remember, finding a new hobby isn't just about distracting yourself from sadness; it's about finding joy and cultivating a sense of fulfillment. Take your time, be gentle with yourself, and always remember that you are deserving of happiness.""}]",identity_74685
"[{'from': 'human', 'value': ""Hi Alex! I'm feeling really worried and conflicted about some health issues I've been experiencing lately. Can we talk about it?""}
 {'from': 'gpt', 'value': ""Of course, Charlie! I'm here to listen and support you. What specifically is causing you the most concern?""}
 {'from': 'human', 'value': ""Well, I've been having frequent headaches, and I'm not sure what's causing them. It's been affecting my daily life and making it hard to focus.""}
 {'from': 'gpt', 'value': 'I understand how frustrating that can be. Headaches can definitely impact our well-being. Have you noticed any patterns or triggers that might be contributing to your headaches?'}
 {'from': 'human', 'value': ""I've noticed that the headaches tend to worsen when I'm stressed or when I spend too much time looking at screens. But sometimes, they just come out of nowhere, and that's what worries me the most.""}
 {'from': 'gpt', 'value': ""It's great that you've already identified some potential triggers. Stress and screen time can indeed be factors in triggering headaches. How do you typically manage your stress levels?""}
 {'from': 'human', 'value': ""I try to practice deep breathing exercises and do some light stretching when I feel stressed. It helps me relax momentarily, but it doesn't seem to have a lasting effect.""}
 {'from': 'gpt', 'value': ""It's excellent that you're already using some coping mechanisms. However, finding a long-term solution is crucial. Have you considered seeking medical advice to rule out any underlying causes?""}
 {'from': 'human', 'value': ""I have thought about it, but I'm somewhat hesitant because I don't want to discover something more serious than I anticipated. It's that conflict between wanting to know and being afraid of the potential outcomes.""}
 {'from': 'gpt', 'value': ""I understand your concerns. It's natural to feel conflicted when facing the unknown. Remember, seeking medical advice can provide clarity and guide you towards the appropriate steps for improvement. How would you feel about discussing your concerns with a healthcare professional?""}
 {'from': 'human', 'value': ""I guess I could give it a try. It's just the uncertainty that's been holding me back. I'll take your advice and schedule an appointment to get a professional opinion.""}
 {'from': 'gpt', 'value': ""That's a brave step, Charlie. Remember, uncertainty can be challenging, but seeking answers will help alleviate your worries. Is there anything else health-related that you would like to discuss today?""}
 {'from': 'human', 'value': ""Actually, there is one more thing. Lately, I've been struggling with maintaining a healthy lifestyle. I'm excited about making positive changes, but I often find myself lacking the motivation to follow through.""}
 {'from': 'gpt', 'value': ""It's admirable that you're enthusiastic about making changes, Charlie. Motivation can fluctuate, and it's normal to experience ups and downs on the journey towards a healthier lifestyle. What are your specific goals, and what obstacles are preventing you from achieving them?""}
 {'from': 'human', 'value': 'My primary goals are to improve my diet and engage in regular exercise. However, I often feel overwhelmed by conflicting information and the pressures of daily life, which make it challenging to stay on track.'}
 {'from': 'gpt', 'value': ""I can understand how overwhelming it can be, Charlie. It's essential to approach these changes step by step. Have you considered seeking guidance from a nutritionist or personal trainer who can help you create a realistic and sustainable plan?""}
 {'from': 'human', 'value': ""That's a great suggestion! I hadn't thought of that. I think having professional guidance would provide the support and structure I need to make lasting changes.""}
 {'from': 'gpt', 'value': ""Wonderful! Seeking professional support can make a significant difference in achieving your goals. Always remember to be patient with yourself and celebrate each small victory along the way. Is there anything else you'd like to share or discuss about your health concerns?""}
 {'from': 'human', 'value': ""For now, I think that covers everything. I'm feeling more hopeful and excited about taking charge of my health. Thank you so much for your guidance, Alex!""}
 {'from': 'gpt', 'value': ""You're very welcome, Charlie. I'm here for you every step of the way. Remember, taking care of your health is an exciting and empowering journey. Don't hesitate to reach out whenever you need support or have any more questions. You're doing great!""}]",identity_4216
"[{'from': 'human', 'value': ""Hi Alex! I've been feeling quite anxious lately, and I'm really longing for a sense of peace and change in my life.""}
 {'from': 'gpt', 'value': 'Hello Charlie! Thank you for sharing that with me. It takes a lot of strength to recognize the need for peace and change. What specifically has been causing you anxiety?'}
 {'from': 'human', 'value': 'Well, Alex, I find myself constantly worrying about the future and the uncertainties that lie ahead. It feels overwhelming at times, you know?'}
 {'from': 'gpt', 'value': ""I understand, Charlie. Uncertainties can indeed trigger anxiety. Let's explore why it feels overwhelming. Can you identify any patterns or recurring thoughts that contribute to this anxiety?""}
 {'from': 'human', 'value': ""There's always this fear of failure and not being able to meet my own expectations. It's as if I'm constantly questioning my abilities and whether I'm capable of achieving my goals.""}
 {'from': 'gpt', 'value': ""It sounds like you might be placing a lot of pressure on yourself, Charlie. Remember, change comes from within, and it's essential to set realistic expectations for yourself. How do you think you can begin embracing change in a more peaceful way?""}
 {'from': 'human', 'value': 'I believe that taking small steps towards my goals could be helpful. By breaking things down into manageable tasks, I can overcome the overwhelming feeling and find a sense of peace within the process.'}
 {'from': 'gpt', 'value': ""That's a wonderful perspective, Charlie. Breaking things down into smaller steps is a great strategy to regain control and reduce anxiety. How can you make these steps more tangible and motivating for yourself?""}
 {'from': 'human', 'value': 'I think setting specific and achievable goals would allow me to track my progress and celebrate small victories along the way. It would provide that much-needed motivation and sense of accomplishment.'}
 {'from': 'gpt', 'value': 'Absolutely, Charlie! Celebrating small victories is crucial for boosting motivation. And remember, change often requires a support system. Who can you lean on for emotional support or guidance during this process?'}
 {'from': 'human', 'value': ""I have a few close friends who I trust and who always lift me up when I'm feeling down. They would definitely be a great support system for me.""}
 {'from': 'gpt', 'value': ""That's wonderful to hear, Charlie. Having friends who uplift and support you can make a significant difference in your journey towards peace and change. Have you ever tried any relaxation techniques to manage your anxiety?""}
 {'from': 'human', 'value': ""Yes, I've experimented with deep breathing exercises and mindfulness meditation. They help me relax and bring my focus back to the present moment.""}
 {'from': 'gpt', 'value': 'Excellent, Charlie! Mindfulness can be a powerful tool to bring calmness and clarity to your mind. Are there any other activities or hobbies that bring you a sense of peace and joy?'}
 {'from': 'human', 'value': ""Yes, I've always found solace in nature. Taking long walks in the park or going on hikes allows me to disconnect from the chaos and find inner peace.""}
 {'from': 'gpt', 'value': 'Nature has a unique way of soothing our soul, Charlie. I encourage you to continue engaging in those activities that bring you joy and peace. Now, envisioning a future where change has taken place, how do you think it would impact your anxiety?'}
 {'from': 'human', 'value': 'I believe that embracing change would free me from the constraints of anxiety and allow me to grow in ways I never thought possible. It would bring a sense of liberation and empowerment.'}
 {'from': 'gpt', 'value': ""That's a beautiful vision, Charlie. Embracing change can break the cycle of anxiety and open doors to new opportunities. As we wrap up today's session, what is one small step you commit to taking towards peaceful change in your life?""}
 {'from': 'human', 'value': ""I commit to creating a daily routine that includes moments of self-care, goal-setting, and reflection. It's time to prioritize myself and take that step towards a more peaceful and fulfilling life.""}
 {'from': 'gpt', 'value': ""That's a powerful commitment, Charlie. Remember, change is a journey, and there may be bumps along the way. Celebrate your progress, be kind to yourself, and continue moving forward one step at a time. I'm here to support you every step of the way.""}
 {'from': 'human', 'value': ""Thank you, Alex. I appreciate your guidance and support. I'm ready to embrace change and find that peaceful state I've been longing for.""}
 {'from': 'gpt', 'value': ""You're very welcome, Charlie. It's an honor to be part of your journey. Keep believing in yourself, and remember that change is within your reach. Keep shining bright and let peace guide you towards a more fulfilling life.""}]",identity_91242
"[{'from': 'human', 'value': ""Hi Alex, I hope you're doing well today. I wanted to talk to you about something that's been on my mind. Lately, I've been struggling with finding peace in my personal relationships. It seems like every time I start to trust someone, I end up feeling betrayed. It's been really challenging for me to maintain a positive outlook and keep my spirits up.""}
 {'from': 'gpt', 'value': ""Hello Charlie, I'm glad you reached out and shared your concerns with me. It sounds like you've been going through a tough time, and I'm here to support you. Let's explore this further. What specific incidents have made you feel betrayed? Can you help me understand what happened?""}
 {'from': 'human', 'value': ""Thank you, Alex. Well, recently I confided in a close friend about a personal matter, hoping they would keep it confidential, but they ended up sharing it with others. It left me feeling exposed and hurt. Another time, I invested so much time and effort into a romantic relationship, only to discover that my partner was dishonest with me. It's discouraging, to say the least.""}
 {'from': 'gpt', 'value': ""I see, Charlie. Experiencing betrayal can indeed shake our trust in others and make it challenging to form new connections. It's essential to acknowledge your feelings and give yourself permission to heal. Have you reflected on how these incidents have impacted your perception of yourself and your ability to trust others?""}
 {'from': 'human', 'value': ""Definitely, Alex. I've noticed that I've become more cautious and reluctant to open up to new people. It's like a defense mechanism, you know? I can't shake off the fear of being hurt again, and I find it hard to believe that someone genuinely has good intentions.""}
 {'from': 'gpt', 'value': ""That's understandable, Charlie. Our experiences shape our perception of the world, and it's common to feel guarded after being hurt. However, it's essential to remember that not everyone will betray your trust. Let's try focusing on rebuilding your trust gradually and finding ways to cultivate healthier relationships. What are some positive experiences you've had in the past where you felt supported and cared for?""}
 {'from': 'human', 'value': ""You're right, Alex. I've had moments where I felt truly loved and supported by my family and some close friends. They've shown me that not everyone is out to hurt me. I think it's important to cherish those positive experiences and use them as a foundation for building trust in new relationships.""}
 {'from': 'gpt', 'value': ""Absolutely, Charlie. Holding onto those positive experiences can be incredibly healing. It's also essential to set healthy boundaries in your relationships to safeguard your emotional well-being. Are there any specific boundaries or expectations you'd like to establish moving forward?""}
 {'from': 'human', 'value': ""Setting boundaries is something I've been working on, Alex. I've learned that it's crucial to communicate my needs and expectations clearly. In the past, I've been too accommodating, which made it easier for others to cross the line. Now, I want to make sure I express myself assertively and ensure that my boundaries are respected.""}
 {'from': 'gpt', 'value': ""That's wonderful progress, Charlie. Assertiveness is a powerful tool for maintaining healthy relationships. Remember, it's okay to say no when something doesn't align with your values or makes you uncomfortable. By doing so, you'll attract individuals who genuinely respect and appreciate you for who you are. How do you envision implementing this newfound assertiveness in your relationships?""}
 {'from': 'human', 'value': ""I'm excited to put my assertiveness into action, Alex. Moving forward, I plan to have open and honest conversations with my loved ones, sharing my feelings and needs more clearly. I want to create an environment where we can all respect each other's boundaries and communicate effectively. Building this type of relationship will not only benefit me but also the people around me.""}
 {'from': 'gpt', 'value': ""That's fantastic, Charlie! I'm glad to witness your enthusiasm and determination to make positive changes in your personal relationships. Remember, this process takes time, and it's essential to be patient with yourself. As you continue on this path, I encourage you to celebrate your successes, no matter how small they may seem. Is there anything else on your mind that you'd like to discuss?""}
 {'from': 'human', 'value': ""Thank you, Alex, for your unwavering support and guidance. I think we've covered a lot today, and I'm feeling more positive about my future relationships. I'll definitely keep working on my assertiveness and setting healthy boundaries. I'm grateful for this opportunity to grow.""}
 {'from': 'gpt', 'value': ""You're very welcome, Charlie. I'm here for you whenever you need someone to talk to. Remember, healing and growth are ongoing processes, and it's okay to reach out for support along the way. Keep up the great work, and let's continue working together to create peaceful and fulfilling relationships.""}]",identity_58153
"[{'from': 'human', 'value': ""Hi Alex, I hope you're doing well. I decided to reach out for some therapy because I'm feeling really down lately. I've been struggling with some financial issues, and it's been making me feel even more depressed.""}
 {'from': 'gpt', 'value': ""Hello Charlie, thank you for reaching out. I'm here to support you through this difficult time. I can understand how financial difficulties can greatly impact one's emotional well-being. Could you please tell me a little more about your current financial situation and how it's affecting you?""}
 {'from': 'human', 'value': ""Well, Alex, I recently lost my job due to company downsizing, and it's been a real blow to my self-esteem. It feels like a personal failure, and I can't help but question my own worth. The financial strain is overwhelming, and it's hard to see a way out of this situation.""}
 {'from': 'gpt', 'value': ""I can imagine how devastating losing your job can be, especially when it impacts your self-esteem and overall sense of worth. Remember, Charlie, your value and worth as a person are not defined solely by your job or financial situation. It's understandable that you're feeling overwhelmed, but it's important to take a step back and assess the situation calmly. What specific aspects of your finances are causing the most distress?""}
 {'from': 'human', 'value': ""Thank you, Alex. You're right, I need to remind myself that my worth goes beyond my job and financial status. The most distressing aspect is my mounting debt. I have credit card bills piling up, and I'm struggling to make ends meet. It's difficult to find any sense of stability or security in my life right now.""}
 {'from': 'gpt', 'value': ""I hear your concerns, Charlie, and it's completely natural to feel overwhelmed by debt. Let's explore your feelings further. How does this financial burden affect your day-to-day life? Are there any other areas of your life that it's impacting?""}
 {'from': 'human', 'value': ""The financial burden is taking a toll on my daily life, Alex. I'm constantly stressed about how I'm going to pay my bills and afford basic necessities. It's hard to focus on anything else, including finding a new job or investing time in my hobbies and relationships. I feel like I'm stuck in this never-ending cycle of worry and despair.""}
 {'from': 'gpt', 'value': ""I can sense the weight that this financial struggle is placing on you, Charlie. It's important to remember that you are not alone in this. Many people face challenging financial circumstances at some point in their lives. Let's take a moment to reflect on your self-esteem. How has this situation impacted your self-image and how you perceive yourself?""}
 {'from': 'human', 'value': ""This situation has definitely caused my self-esteem to plummet, Alex. I've always associated financial stability with personal success, and now that I'm facing financial difficulties, it feels like I've failed in some way. I question my abilities, my competence, and it's hard to believe in myself when I can't seem to overcome this financial hurdle.""}
 {'from': 'gpt', 'value': ""It's understandable that this situation is affecting your self-image, Charlie. However, I want you to know that your worth and value are not determined by your financial circumstances. You are much more than your current struggles. Let's explore ways to rebuild your self-esteem and regain confidence. What are some positive aspects about yourself that you can recognize, regardless of your financial situation?""}]",identity_13543
